intervencionId;codigoSitio;NombreSitio;NombreProyecto;Nombre;Apellido;nombreCorto;EMG;Region;ICD;CasoSigo;estadoSigo;fechaRFPSIGO;fechaRFISIGO;fechaRFASIGO;fechaRFTSIGO;fechaOASIGO;contratista;Latitud;Longitud;ALM;ManoObra;Vendor;EstadoIM;subEstado;FechaEstadoIM;fechaRFPSIM;fechaRFISIM;fechaRFASIM;fechaRFTSIM;fechaOASIM;FechaIntegracionProgramada
19568;A04-S437;Rosario Ambito;NB_IOT;Sin Asignar;Sin Asignar;Sin Asignar;ZRAMBI;LITO;;ISM-10191;OA;2020-11-13;2020-11-13;2021-02-09;2021-02-09;2021-02-10;;-329.401;-606.471;A04;MOP;Nokia;OA;OA Completado;2021-02-09;;2021-02-09;2021-02-09;2021-02-09;2021-02-09;2021-02-09
19576;A04-S462;Rosario Lola Mora (Reemplaza A04-S116);NB_IOT;Sin Asignar;Sin Asignar;Sin Asignar;ZRLOLA;LITO;;ISM-10199;OA;2020-11-13;2020-11-13;2021-02-09;2021-02-09;2021-02-10;;-329.408;-606.453;A04;MOP;Nokia;OA;OA Completado;2021-02-09;;2021-02-09;2021-02-09;2021-02-09;2021-02-09;2021-02-09
19608;A04-S681;Rosario Sede Gobernacion;NB_IOT;Sin Asignar;Sin Asignar;Sin Asignar;ZRSGOB;LITO;;ISM-10231;OA;2020-11-17;2020-11-17;2021-02-09;2021-02-09;2021-02-10;;;;;MOP;Nokia;OA;OA Completado;2021-02-17;;2021-02-09;2021-02-09;2021-02-09;2021-02-17;2021-02-09
19615;A06-S009;Rafaela Repetidora;NB_IOT;Sin Asignar;Sin Asignar;Sin Asignar;ZRAFRE;LITO;;ISM-10238;OA;2020-11-17;2020-11-17;2021-01-21;2021-01-21;2021-01-22;;-312.321;-61.496;A06;MOP;Huawei;OA;OA Completado;2021-01-22;;2021-01-21;2021-01-21;2021-01-22;2021-01-22;2021-01-22
19616;A06-S014;Rafaela Central;NB_IOT;Sin Asignar;Sin Asignar;Sin Asignar;ZRAFCE;LITO;;ISM-10239;OA;2020-11-17;2020-11-17;2021-01-21;2021-01-22;2021-01-22;;-31.252;-614.876;A06;MOP;Huawei;;;;;2021-01-21;2021-01-21;2021-01-22;2021-01-22;2021-01-22
19617;A06-S073;Rafaela 2;NB_IOT;Sin Asignar;Sin Asignar;Sin Asignar;ZRAFAE;LITO;;ISM-10240;OA;2020-11-17;2020-11-17;2021-01-05;2021-01-06;2021-01-27;;-31.263;-614.598;A06;MOP;Huawei;;;;;2021-01-05;2021-01-05;2021-01-06;2021-01-27;2021-01-06
19618;A06-S112;Rafaela 6;NB_IOT;Sin Asignar;Sin Asignar;Sin Asignar;ZRAFAF;LITO;;ISM-10241;OA;2020-11-17;2020-11-17;2021-01-21;2021-01-21;2021-01-22;;-312.546;-61.49;A06;MOP;Huawei;OA;OA Completado;2021-01-22;;2021-01-21;2021-01-21;2021-01-22;2021-01-22;2021-01-22
19619;A06-S147;RAFAELA 4;NB_IOT;Sin Asignar;Sin Asignar;Sin Asignar;ZRAFEM;LITO;;ISM-10242;OA;2020-11-17;2020-11-17;2021-01-05;2021-01-06;2021-01-12;;;;;MOP;Huawei;OA;OA Completado;2021-01-12;;2021-01-05;2021-01-05;2021-01-06;2021-01-12;2021-01-06
19628;A03-S062;Cordoba Ciadea;NB_IOT;Sin Asignar;Sin Asignar;Sin Asignar;XCCIAD;MEDI;;ISM-11802;OA;2020-11-25;2020-11-25;2021-02-08;2021-02-09;2021-02-17;;-314.708;-642.586;A03;MOP;Huawei;OA;OA Completado;2021-02-08;;2021-01-25;2021-02-08;2021-02-08;2021-02-08;2021-02-08
19635;A03-S235;Cordoba General Bustos;NB_IOT;Sin Asignar;Sin Asignar;Sin Asignar;XCBUST;MEDI;;ISM-9900;OA;2021-01-26;2021-01-26;2021-01-26;2021-01-26;2021-01-26;;-313.969;-641.754;A03;MOP;Huawei;OA;OA Completado;2021-01-26;;2021-01-22;2021-01-25;2021-01-25;2021-01-26;2021-01-25
19637;A03-S248;Cordoba Aeropuerto;NB_IOT;MATIAS EZEQUIEL;COSENTINO;M. COSENTINO;XCAERO;MEDI;;ISM-9902;OA;2021-03-03;2021-03-03;2021-03-03;2021-03-05;2021-03-08;;-313.134;-642.142;A03;MOP;Huawei;OA;OA Completado;2021-03-08;;2021-02-17;2021-02-17;2021-02-17;2021-03-08;2021-02-17
19641;A03-S446;Cordoba Campus Siglo Xxi;NB_IOT;Sin Asignar;Sin Asignar;Sin Asignar;XCCXXI;MEDI;;ISM-9944;OA;2020-11-25;2020-11-25;2021-01-27;2021-01-27;2021-01-28;;-313.219;-642.223;A03;MOP;Huawei;OA;OA Completado;2021-01-27;;2021-01-27;2021-01-27;2021-01-27;2021-01-27;2021-01-27
19646;A03-S291;Cordoba Palmar;NB_IOT;Sin Asignar;Sin Asignar;Sin Asignar;XCPALM;MEDI;;ISM-9949;OA;2020-11-25;2020-11-25;2021-01-28;2021-01-28;2021-01-28;;-313.944;-641.236;A03;MOP;Huawei;OA;OA Completado;2021-01-28;;2021-01-28;2021-01-28;2021-01-28;2021-01-28;2021-01-28
19649;A03-S053;Cordoba Alvear;NB_IOT;Sin Asignar;Sin Asignar;Sin Asignar;XCALVE;MEDI;;ISM-9952;OA;2020-11-13;2020-11-13;2021-01-21;2021-01-22;2021-01-22;;-314.166;-641.811;A03;MOP;Huawei;OA;OA Completado;2021-01-22;;2021-01-21;2021-01-21;2021-01-22;2021-01-22;2021-01-22
19653;A03-S473;Cordoba La Carbonada;NB_IOT;Sin Asignar;Sin Asignar;Sin Asignar;XCARBO;MEDI;;ISM-9956;OA;2020-11-19;2020-11-19;2021-01-27;2021-01-28;2021-01-28;;-314.643;-641.269;A03;MOP;Huawei;OA;OA Completado;2021-01-28;;2021-01-27;2021-01-27;2021-01-28;2021-01-28;2021-01-28
19655;A03-S064;Cordoba Shopping;NB_IOT;Sin Asignar;Sin Asignar;Sin Asignar;XCSHOP;MEDI;;ISM-9958;OA;2020-11-25;2020-11-25;2021-01-25;2021-01-25;2021-01-25;;-314.116;-642.073;A03;MOP;Huawei;OA;OA Completado;2021-01-25;;2021-01-25;2021-01-25;2021-01-25;2021-01-25;2021-01-25
19659;A03-S179;Cordoba Los Pinos;NB_IOT;Sin Asignar;Sin Asignar;Sin Asignar;XCPINO;MEDI;;ISM-9962;OA;2020-11-17;2020-11-17;2021-01-21;2021-01-25;2021-01-25;;-313.905;-641.448;A03;MOP;Huawei;OA;OA Completado;2021-01-25;;2021-01-21;2021-01-21;2021-01-25;2021-01-25;2021-01-25
19660;A03-S643;Cordoba Las Rosas Plaza;NB_IOT;MATIAS EZEQUIEL;COSENTINO;M. COSENTINO;XCLROS;MEDI;;ISM-9963;OA;2020-11-19;2020-11-19;2021-02-17;2021-03-03;2021-03-05;;-313.927;-642.209;A03;MOP;Huawei;OA;OA Completado;2021-03-08;;2021-02-17;2021-02-17;2021-02-17;2021-03-08;2021-02-17
19662;A03-S623;Julio De Vedia;NB_IOT;Sin Asignar;Sin Asignar;Sin Asignar;XCJDVE;MEDI;;ISM-9965;OA;2020-11-19;2020-11-19;2021-01-13;2021-01-14;2021-01-15;;-313.853;-641.427;A03;MOP;Huawei;OA;OA Completado;2021-01-17;;2021-01-13;2021-01-13;2021-01-13;2021-01-17;2021-01-13
19665;A03-S466;Cordoba Angelelli;NB_IOT;MATIAS EZEQUIEL;COSENTINO;M. COSENTINO;XCANGE;MEDI;;ISM-9968;OA;2020-11-19;2020-11-19;2021-02-17;2021-03-03;2021-03-05;;-315.097;-642.113;A03;MOP;Huawei;OA;OA Completado;2021-03-08;;2021-02-11;2021-02-11;2021-02-11;2021-03-08;2021-02-11
19666;A03-S059;Cordoba  Liceo;NB_IOT;Sin Asignar;Sin Asignar;Sin Asignar;XCLICE;MEDI;;ISM-9969;OA;2020-11-17;2020-11-17;2021-01-22;2021-01-22;2021-01-25;;-31.352;-641.805;A03;MOP;Huawei;OA;OA Completado;2021-01-25;;2021-01-20;2021-01-22;2021-01-22;2021-01-25;2021-01-22
19667;A03-S259;Cordoba Jardin Espinosa;NB_IOT;Sin Asignar;Sin Asignar;Sin Asignar;XCJESP;MEDI;;ISM-9970;OA;2020-11-20;2020-11-20;2021-01-13;2021-01-14;2021-01-15;;-314.555;-641.812;A03;MOP;Huawei;OA;OA Completado;2021-01-17;;2021-01-13;2021-01-13;2021-01-13;2021-01-17;2021-01-13
19675;A03-S414;Cordoba Libertador Sur;NB_IOT;Sin Asignar;Sin Asignar;Sin Asignar;XCLIBS;MEDI;;ISM-9978;OA;2020-11-18;2020-11-18;2021-01-27;2021-01-27;2021-01-28;;-314.781;-642.206;A03;MOP;Huawei;OA;OA Completado;2021-01-28;;2021-01-27;2021-01-27;2021-01-27;2021-01-28;2021-01-27
19678;A03-S769;Cordoba Club Los Boulevares;NB_IOT;Sin Asignar;Sin Asignar;Sin Asignar;XCCBOU;MEDI;;ISM-9981;OA;2020-11-20;2020-11-20;2021-01-05;2021-01-06;2021-01-12;;-313.433;-64.226;A03;MOP;Huawei;OA;OA Completado;2021-01-12;;2021-01-05;2021-01-05;2021-01-06;2021-01-12;2021-01-06
19679;A03-S075;Cordoba Arguello;NB_IOT;Sin Asignar;Sin Asignar;Sin Asignar;XCARGU;MEDI;;ISM-9983;OA;2020-11-20;2020-11-20;2020-12-24;2020-12-28;2021-01-15;;-313.373;-642.555;A03;MOP;Huawei;OA;OA Completado;2021-01-21;;2021-01-05;2021-01-11;2021-01-11;2021-01-21;2021-01-11
19682;A03-S138;Cordoba Santa Ana;NB_IOT;Sin Asignar;Sin Asignar;Sin Asignar;XCSANA;MEDI;;ISM-9985;OA;2020-11-17;2020-11-17;2021-01-05;2021-01-06;2021-01-12;;-314.141;-642.278;A03;MOP;Huawei;OA;OA Completado;2021-01-12;;2021-01-05;2021-01-05;2021-01-06;2021-01-12;2021-01-06
19694;A03-S622;Heroes De Vilcapugio;NB_IOT;Sin Asignar;Sin Asignar;Sin Asignar;XCHEVI;MEDI;;ISM-9997;OA;2020-11-19;2020-11-19;2021-01-05;2021-01-06;2021-01-12;;-313.711;-641.362;A03;MOP;Huawei;OA;OA Completado;2021-01-12;;2021-01-05;2021-01-05;2021-01-06;2021-01-12;2021-01-06
19695;A03-S621;Cordoba Renault;NB_IOT;Sin Asignar;Sin Asignar;Sin Asignar;XCRENA;MEDI;;ISM-9998;OA;2020-11-19;2020-11-19;2021-01-05;2021-01-06;2021-01-12;;-314.642;-64.235;A03;MOP;Huawei;OA;OA Completado;2021-01-12;;2021-01-05;2021-01-05;2021-01-06;2021-01-12;2021-01-06
19698;A03-S495;Av Japon;NB_IOT;Sin Asignar;Sin Asignar;Sin Asignar;XCJAPO;MEDI;;ISM-10001;OA;2020-11-19;2020-11-19;2021-01-27;2021-01-28;2021-01-28;;-313.353;-642.019;A03;MOP;Huawei;OA;OA Completado;2021-01-28;;2021-01-27;2021-01-27;2021-01-28;2021-01-28;2021-01-28
19700;A03-S345;Cordoba Cofico;NB_IOT;Sin Asignar;Sin Asignar;Sin Asignar;XCCOFI;MEDI;;ISM-10003;OA;2020-11-18;2020-11-18;2021-01-13;2021-01-14;2021-01-15;;-313.982;-641.886;A03;MOP;Huawei;OA;OA Completado;2021-01-17;;2021-01-13;2021-01-13;2021-01-13;2021-01-17;2021-01-13
19702;A03-S240;Cordoba 20 De Julio;NB_IOT;Sin Asignar;Sin Asignar;Sin Asignar;XC20JU;MEDI;;ISM-10005;OA;2020-11-17;2020-11-17;2021-01-21;2021-01-22;2021-01-25;;-314.096;-642.685;A03;MOP;Huawei;OA;OA Completado;2021-01-25;;2021-01-21;2021-01-21;2021-01-22;2021-01-25;2021-01-22
19705;A03-S315;Cordoba Cerutti;NB_IOT;Sin Asignar;Sin Asignar;Sin Asignar;XCCERU;MEDI;;ISM-10008;OA;2020-11-18;2020-11-18;2021-01-13;2021-01-14;2021-01-15;;-313.946;-641.936;A03;MOP;Huawei;OA;OA Completado;2021-01-17;;2021-01-13;2021-01-13;2021-01-13;2021-01-17;2021-01-13
19706;A03-S108;Cordoba Hipodromo;NB_IOT;Sin Asignar;Sin Asignar;Sin Asignar;XCHIPO;MEDI;;ISM-10009;OA;2020-11-17;2020-11-17;2021-01-21;2021-01-25;2021-01-25;;-314.463;-641.888;A03;MOP;Huawei;OA;OA Completado;2021-01-25;;2021-01-21;2021-01-21;2021-01-25;2021-01-25;2021-01-25
19707;A03-S109;Cordoba Villa  Claret;NB_IOT;Sin Asignar;Sin Asignar;Sin Asignar;XCCLAR;MEDI;;ISM-10010;OA;2020-11-17;2020-11-17;2021-01-21;2021-01-25;2021-01-25;;-313.556;-642.398;A03;MOP;Huawei;OA;OA Completado;2021-01-25;;2021-01-21;2021-01-21;2021-01-25;2021-01-25;2021-01-25
19709;A03-S395;Cordoba Vulcan;NB_IOT;MATIAS EZEQUIEL;COSENTINO;M. COSENTINO;XCVULC;MEDI;;ISM-10012;OA;2020-11-18;2020-11-18;2021-02-17;2021-03-03;2021-03-05;;-313.206;-642.719;A03;MOP;Huawei;OA;OA Completado;2021-03-08;;2021-02-11;2021-02-11;2021-02-11;2021-03-08;2021-02-11
19714;A03-S600;CORDOBA DIEGO CALA CV;NB_IOT;Sin Asignar;Sin Asignar;Sin Asignar;XCDCAL;MEDI;;ISM-10017;OA;2020-11-19;2020-11-19;2021-01-27;2021-01-27;2021-01-28;;-314.063;-642.321;A03;MOP;Huawei;OA;OA Completado;2021-01-27;;2021-01-27;2021-01-27;2021-01-27;2021-01-27;2021-01-27
19715;A03-S244;Cordoba Yofre;NB_IOT;Sin Asignar;Sin Asignar;Sin Asignar;XCYOFR;MEDI;;ISM-10018;OA;2020-11-20;2020-11-20;2021-01-13;2021-01-14;2021-01-15;;-313.775;-641.358;A03;MOP;Huawei;OA;OA Completado;2021-01-17;;2021-01-13;2021-01-13;2021-01-13;2021-01-17;2021-01-13
19721;A03-S236;Cordoba Jardin;NB_IOT;Sin Asignar;Sin Asignar;Sin Asignar;XCJARD;MEDI;;ISM-10024;OA;2020-11-17;2020-11-17;2021-01-22;2021-01-22;2021-01-25;;-314.442;-641.639;A03;MOP;Huawei;OA;OA Completado;2021-01-25;;2021-01-22;2021-01-22;2021-01-22;2021-01-25;2021-01-22
19723;A03-S722;Cordoba Gamerman;NB_IOT;Sin Asignar;Sin Asignar;Sin Asignar;XCGABE;MEDI;;ISM-10026;OA;2020-11-20;2020-11-20;2021-01-27;2021-01-27;2021-01-28;;-314.334;-641.338;A03;MOP;Huawei;OA;OA Completado;2021-01-28;;2021-01-27;2021-01-27;2021-01-28;2021-01-28;2021-01-28
19725;A03-S445;Cordoba Soconcho;NB_IOT;Sin Asignar;Sin Asignar;Sin Asignar;XCSOCO;MEDI;;ISM-10028;OA;2020-11-19;2020-11-19;2021-01-28;2021-01-28;2021-01-28;;-314.567;-641.603;A03;MOP;Huawei;OA;OA Completado;2021-01-28;;2021-01-28;2021-01-28;2021-01-28;2021-01-28;2021-01-28
19727;A03-S060;Cordoba Ura Patricios;NB_IOT;Sin Asignar;Sin Asignar;Sin Asignar;XCPATR;MEDI;;ISM-10030;OA;2020-11-17;2020-11-17;2021-01-25;2021-01-25;2021-01-25;;-313.758;-641.529;A03;MOP;Huawei;OA;OA Completado;2021-01-25;;2021-01-25;2021-01-25;2021-01-25;2021-01-25;2021-01-25
19731;A03-S264;Cordoba Lockeed;NB_IOT;MATIAS EZEQUIEL;COSENTINO;M. COSENTINO;XCLOCK;MEDI;;ISM-10034;OA;2020-11-18;2020-11-18;2021-02-17;2021-03-03;2021-03-05;;-31.439;-642.685;A03;MOP;Huawei;OA;OA Completado;2021-03-08;;2021-02-11;2021-02-11;2021-02-11;2021-03-08;2021-02-11
19732;A03-S449;Cordoba Milenica;NB_IOT;Sin Asignar;Sin Asignar;Sin Asignar;XCMILE;MEDI;;ISM-10035;OA;2020-11-19;2020-11-19;2021-01-27;2021-01-28;2021-01-28;;-313.704;-64.221;A03;MOP;Huawei;OA;OA Completado;2021-01-28;;2021-01-27;2021-01-27;2021-01-28;2021-01-28;2021-01-28
19733;A03-S340;Cordoba Rivera Indarte;NB_IOT;Sin Asignar;Sin Asignar;Sin Asignar;XCRIVE;MEDI;;ISM-10036;OA;2020-11-18;2020-11-18;2021-01-27;2021-01-28;2021-01-28;;-313.206;-642.926;A03;MOP;Huawei;OA;OA Completado;2021-01-28;;2021-01-27;2021-01-27;2021-01-28;2021-01-28;2021-01-28
19736;A03-S632;Cordoba Buro;NB_IOT;Sin Asignar;Sin Asignar;Sin Asignar;XCBURO;MEDI;;ISM-10039;OA;2020-11-19;2020-11-19;2021-01-28;2021-01-28;2021-01-28;;-31.348;-642.617;A03;MOP;Huawei;OA;OA Completado;2021-01-28;;2021-01-28;2021-01-28;2021-01-28;2021-01-28;2021-01-28
19737;A03-S447;Cordoba Circunvalacion Oeste;NB_IOT;Sin Asignar;Sin Asignar;Sin Asignar;XCCIRO;MEDI;;ISM-10040;OA;2020-11-19;2020-11-19;2021-01-27;2021-01-28;2021-01-28;;-31.456;-642.497;A03;MOP;Huawei;OA;OA Completado;2021-01-28;;2021-01-27;2021-01-27;2021-01-28;2021-01-28;2021-01-28
19738;A03-S046;Cordoba Villa Paez;NB_IOT;Sin Asignar;Sin Asignar;Sin Asignar;XCPAEZ;MEDI;;ISM-10041;OA;2020-11-13;2020-11-13;2021-01-21;2021-01-22;2021-01-22;;-313.943;-642.098;A03;MOP;Huawei;OA;OA Completado;2021-01-22;;2021-01-21;2021-01-21;2021-01-22;2021-01-22;2021-01-22
19739;A03-S397;Cordoba Wall Mart Ruta 20;NB_IOT;Sin Asignar;Sin Asignar;Sin Asignar;XCWR20;MEDI;;ISM-10042;OA;2020-11-18;2020-11-18;2021-01-27;2021-01-27;2021-01-28;;-314.317;-642.435;A03;MOP;Huawei;OA;OA Completado;2021-01-28;;2021-01-27;2021-01-27;2021-01-28;2021-01-28;2021-01-28
19741;A03-S042;Cordoba Marques;NB_IOT;Sin Asignar;Sin Asignar;Sin Asignar;XCMARQ;MEDI;;ISM-10044;OA;2020-11-20;2020-11-20;2021-01-22;2021-01-22;2021-01-25;;-313.696;-642.065;A03;MOP;Huawei;OA;OA Completado;2021-01-25;;2021-01-20;2021-01-22;2021-01-22;2021-01-25;2021-01-22
19743;A03-S058;Cordoba  Aviones;NB_IOT;Sin Asignar;Sin Asignar;Sin Asignar;XCAVIO;MEDI;;ISM-10046;OA;2020-11-13;2020-11-13;2021-01-22;2021-01-22;2021-01-25;;-314.335;-642.395;A03;MOP;Huawei;OA;OA Completado;2021-01-25;;2021-01-22;2021-01-22;2021-01-22;2021-01-25;2021-01-22
19745;A03-S094;Cordoba Hipolito Yrigoyen;NB_IOT;Sin Asignar;Sin Asignar;Sin Asignar;XCIRIG;MEDI;;ISM-10048;OA;2020-11-17;2020-11-17;2021-01-22;2021-01-22;2021-01-25;;-314.214;-641.883;A03;MOP;Huawei;OA;OA Completado;2021-01-25;;2021-01-20;2021-01-22;2021-01-22;2021-01-25;2021-01-22
19746;A03-S423;Cordoba Villa Agur;NB_IOT;Sin Asignar;Sin Asignar;Sin Asignar;XCVAGU;MEDI;;ISM-10049;OA;2020-11-18;2020-11-18;2021-01-27;2021-01-27;2021-01-28;;-313.707;-642.349;A03;MOP;Huawei;OA;OA Completado;2021-01-27;;2021-01-27;2021-01-27;2021-01-27;2021-01-27;2021-01-27
19749;A03-S263;Cordoba Fincas Del Sur;NB_IOT;Sin Asignar;Sin Asignar;Sin Asignar;XCFISU;MEDI;;ISM-10052;OA;2020-11-18;2020-11-18;2021-01-13;2021-01-14;2021-01-15;;-314.928;-641.617;A03;MOP;Huawei;OA;OA Completado;2021-01-17;;2021-01-13;2021-01-13;2021-01-13;2021-01-17;2021-01-13
19750;A03-S793;Cordoba Orgaz;NB_IOT;Sin Asignar;Sin Asignar;Sin Asignar;XCORGZ;MEDI;;ISM-10053;OA;2020-11-20;2020-11-20;2021-01-27;2021-01-27;2021-01-28;;-314.054;-642.082;A03;MOP;Huawei;OA;OA Completado;2021-01-28;;2021-01-27;2021-01-27;2021-01-27;2021-01-28;2021-01-27
19751;A03-S386;Cordoba Patria;NB_IOT;Sin Asignar;Sin Asignar;Sin Asignar;XCAPAT;MEDI;;ISM-10054;OA;2020-11-18;2020-11-18;2021-01-27;2021-01-27;2021-01-28;;-314.016;-641.604;A03;MOP;Huawei;OA;OA Completado;2021-01-28;;2021-01-27;2021-01-27;2021-01-27;2021-01-28;2021-01-27
19753;A03-S776;Cordoba Capdevila;NB_IOT;Sin Asignar;Sin Asignar;Sin Asignar;XCCAPD;MEDI;;ISM-10056;OA;2020-11-20;2020-11-20;2021-01-27;2021-01-27;2021-01-28;;-31.378;-641.652;A03;MOP;Huawei;OA;OA Completado;2021-01-27;;2021-01-27;2021-01-27;2021-01-27;2021-01-27;2021-01-27
19757;A03-S757;Cordoba Pinelo;NB_IOT;Sin Asignar;Sin Asignar;Sin Asignar;XCPINE;MEDI;;ISM-10060;OA;2020-11-20;2020-11-20;2021-01-28;2021-01-28;2021-01-28;;;;;MOP;Huawei;OA;OA Completado;2021-01-28;;2021-01-28;2021-01-28;2021-01-28;2021-01-28;2021-01-28
19759;A03-S740;Cordoba 11 de Septiembre;NB_IOT;Sin Asignar;Sin Asignar;Sin Asignar;XC11SE;MEDI;;ISM-10062;OA;2020-11-20;2020-11-20;2021-01-27;2021-01-27;2021-01-28;;-314.562;-641.481;A03;MOP;Huawei;OA;OA Completado;2021-01-27;;2021-01-27;2021-01-27;2021-01-27;2021-01-27;2021-01-27
19765;A03-S491;Illia;NB_IOT;Sin Asignar;Sin Asignar;Sin Asignar;XCILIA;MEDI;;ISM-10068;OA;2020-11-19;2020-11-19;2021-01-27;2021-01-27;2021-01-28;;-31.422;-641.804;A03;MOP;Huawei;OA;OA Completado;2021-01-27;;2021-01-27;2021-01-27;2021-01-27;2021-01-27;2021-01-27
19766;A03-S960;Cordoba El Tala;NB_IOT;Sin Asignar;Sin Asignar;Sin Asignar;XCTALA;MEDI;;ISM-10069;OA;2020-11-20;2020-11-20;2021-01-28;2021-01-28;2021-01-28;;;;;MOP;Huawei;OA;OA Completado;2021-01-28;;2021-01-28;2021-01-28;2021-01-28;2021-01-28;2021-01-28
19770;A03-S639;Cordoba Matienzo;NB_IOT;Sin Asignar;Sin Asignar;Sin Asignar;XCMATI;MEDI;;ISM-10073;OA;2020-11-19;2020-11-19;2021-01-28;2021-01-28;2021-01-28;;;;;MOP;Huawei;OA;OA Completado;2021-01-28;;2021-01-28;2021-01-28;2021-01-28;2021-01-28;2021-01-28
19771;A03-S580;Cordoba Germania;NB_IOT;Sin Asignar;Sin Asignar;Sin Asignar;XCGERM;MEDI;;ISM-10074;OA;2020-11-19;2020-11-19;2021-01-28;2021-01-28;2021-01-28;;;;;MOP;Huawei;OA;OA Completado;2021-01-28;;2021-01-28;2021-01-28;2021-01-28;2021-01-28;2021-01-28
19772;A03-S336;Cordoba Propietarian;NB_IOT;Sin Asignar;Sin Asignar;Sin Asignar;XCPROP;MEDI;;ISM-10075;OA;2020-11-18;2020-11-18;2021-01-27;2021-01-28;2021-01-28;;-314.015;-642.258;A03;MOP;Huawei;OA;OA Completado;2021-01-28;;2021-01-27;2021-01-27;2021-01-28;2021-01-28;2021-01-28
19773;A03-S464;Cordoba Sta. Fe;NB_IOT;Sin Asignar;Sin Asignar;Sin Asignar;XCSTFE;MEDI;;ISM-10076;OA;2020-11-19;2020-11-19;2021-01-27;2021-01-27;2021-01-28;;;;;MOP;Huawei;OA;OA Completado;2021-01-27;;2021-01-27;2021-01-27;2021-01-27;2021-01-27;2021-01-27
19774;A03-S730;Cordoba Parque De La Vida;NB_IOT;Sin Asignar;Sin Asignar;Sin Asignar;XCPDLV;MEDI;;ISM-10077;OA;2020-11-20;2020-11-20;2021-01-27;2021-01-28;2021-01-28;;-314.449;-64.212;A03;MOP;Huawei;OA;OA Completado;2021-01-28;;2021-01-27;2021-01-27;2021-01-28;2021-01-28;2021-01-28
19776;A03-S666;Cordoba Montironi;NB_IOT;Sin Asignar;Sin Asignar;Sin Asignar;XCMONT;MEDI;;ISM-10079;OA;2020-11-19;2020-11-19;2021-01-13;2021-01-14;2021-01-15;;-313.921;-642.045;A03;MOP;Huawei;OA;OA Completado;2021-01-17;;2021-01-13;2021-01-13;2021-01-13;2021-01-17;2021-01-13
19783;A03-S674;Cordoba Sofia Bozan;NB_IOT;Sin Asignar;Sin Asignar;Sin Asignar;XCSOBA;MEDI;;ISM-10086;OA;2020-11-20;2020-11-20;2021-01-28;2021-01-28;2021-01-28;;-313.736;-641.717;A03;MOP;Huawei;OA;OA Completado;2021-01-28;;2021-01-28;2021-01-28;2021-01-28;2021-01-28;2021-01-28
19785;A03-S262;Cordoba Valle Escondido;NB_IOT;Sin Asignar;Sin Asignar;Sin Asignar;XCVAES;MEDI;;ISM-10088;OA;2020-11-18;2020-11-18;2021-01-21;2021-01-22;2021-01-22;;-313.747;-642.861;A03;MOP;Huawei;OA;OA Completado;2021-01-22;;2021-01-21;2021-01-21;2021-01-22;2021-01-22;2021-01-22
19786;A03-S239;Cordoba Parque Horizonte;NB_IOT;Sin Asignar;Sin Asignar;Sin Asignar;XCHORI;MEDI;;ISM-10089;OA;2020-11-17;2020-11-17;2021-01-21;2021-01-22;2021-01-25;;-314.626;-642.075;A03;MOP;Huawei;OA;OA Completado;2021-01-25;;2021-01-21;2021-01-21;2021-01-22;2021-01-25;2021-01-22
19787;A03-S260;Cordoba Guiñazu;NB_IOT;Sin Asignar;Sin Asignar;Sin Asignar;XCGUIN;MEDI;;ISM-10090;OA;2020-11-20;2020-11-20;2021-01-21;2021-01-22;2021-01-25;;-313.072;-641.756;A03;MOP;Huawei;OA;OA Completado;2021-01-25;;2021-01-21;2021-01-21;2021-01-22;2021-01-25;2021-01-22
19789;A03-S418;Villa  Esquiu;NB_IOT;MATIAS EZEQUIEL;COSENTINO;M. COSENTINO;XVESQU;MEDI;;ISM-10092;OA;2020-11-18;2020-11-18;2021-02-17;2021-03-03;2021-03-05;;-313.594;-641.089;A03;MOP;Huawei;OA;OA Completado;2021-03-08;;2021-02-11;2021-02-11;2021-02-11;2021-03-08;2021-02-11
19794;A03-S110;Cordoba Observatorio;NB_IOT;Sin Asignar;Sin Asignar;Sin Asignar;XCOBSE;MEDI;;ISM-10097;OA;2020-11-17;2020-11-17;2021-01-22;2021-01-22;2021-01-25;;-314.199;-641.996;A03;MOP;Huawei;OA;OA Completado;2021-01-25;;2021-01-22;2021-01-22;2021-01-22;2021-01-25;2021-01-22
19795;A03-S467;Cordoba Ciudad Gama;NB_IOT;Sin Asignar;Sin Asignar;Sin Asignar;XCCGAM;MEDI;;ISM-10098;OA;2020-11-19;2020-11-19;2021-01-28;2021-01-28;2021-01-28;;-313.973;-642.458;A03;MOP;Huawei;OA;OA Completado;2021-01-28;;2021-01-28;2021-01-28;2021-01-28;2021-01-28;2021-01-28
19796;A03-S400;Cordoba Centro Civico;NB_IOT;Sin Asignar;Sin Asignar;Sin Asignar;XCCIVI;MEDI;;ISM-10099;OA;2020-11-20;2020-11-20;2021-02-22;2021-02-23;2021-02-24;;-314.185;-641.738;A03;MOP;Huawei;OA;OA Completado;2021-02-24;;2021-02-22;2021-02-22;2021-02-23;2021-02-24;2021-02-23
19797;A03-S430;Cordoba Instituto;NB_IOT;MATIAS EZEQUIEL;COSENTINO;M. COSENTINO;XCINST;MEDI;;ISM-10100;OA;2020-11-19;2020-11-19;2021-02-17;2021-03-04;2021-03-05;;-313.841;-641.807;A03;MOP;Huawei;OA;OA Completado;2021-03-08;;2021-02-11;2021-02-11;2021-02-11;2021-03-08;2021-02-11
19799;A03-S406;Cordoba Providencia;NB_IOT;Sin Asignar;Sin Asignar;Sin Asignar;XCPROV;MEDI;;ISM-10102;OA;2020-11-18;2020-11-18;2021-01-27;2021-01-27;2021-01-28;;-313.966;-64.198;A03;MOP;Huawei;OA;OA Completado;2021-01-28;;2021-01-27;2021-01-27;2021-01-27;2021-01-28;2021-01-27
19801;A03-S265;Cordoba Inaudi;NB_IOT;Sin Asignar;Sin Asignar;Sin Asignar;XCINAU;MEDI;;ISM-10104;OA;2020-11-20;2020-11-20;2021-01-28;2021-01-28;2021-01-28;;-314.806;-642.018;A03;MOP;Huawei;OA;OA Completado;2021-01-28;;2021-01-28;2021-01-28;2021-01-28;2021-01-28;2021-01-28
19804;A03-S633;Talleres;NB_IOT;Sin Asignar;Sin Asignar;Sin Asignar;XCTALL;MEDI;;ISM-10107;OA;2020-11-19;2020-11-19;2021-01-13;2021-01-14;2021-01-15;;-314.489;-641.761;A03;MOP;Huawei;OA;OA Completado;2021-01-17;;2021-01-13;2021-01-13;2021-01-13;2021-01-17;2021-01-13
19810;A03-S057;Cordoba Cor Luque;NB_IOT;Sin Asignar;Sin Asignar;Sin Asignar;XCLUQU;MEDI;;ISM-10113;OA;2020-11-13;2020-11-13;2021-01-21;2021-01-22;2021-01-22;;-314.378;-641.332;A03;MOP;Huawei;OA;OA Completado;2021-01-22;;2021-01-21;2021-01-21;2021-01-22;2021-01-22;2021-01-22
19811;A03-S061;Cordoba Alta Cordoba;NB_IOT;MATIAS EZEQUIEL;COSENTINO;M. COSENTINO;XCALTA;MEDI;;ISM-10114;OA;2020-11-17;2020-11-17;2021-02-17;2021-03-04;2021-03-05;;-313.932;-641.863;A03;MOP;Huawei;OA;OA Completado;2021-03-08;;2021-02-11;2021-02-11;2021-02-11;2021-03-08;2021-02-11
19812;A03-S819;Cordoba Los Polacos;NB_IOT;Sin Asignar;Sin Asignar;Sin Asignar;XCPOLA;MEDI;;ISM-10115;OA;2020-11-20;2020-11-20;2021-01-27;2021-01-28;2021-01-28;;-313.405;-642.318;A03;MOP;Huawei;OA;OA Completado;2021-01-28;;2021-01-27;2021-01-27;2021-01-28;2021-01-28;2021-01-28
19813;A03-S278;Cordoba Minetti;NB_IOT;Sin Asignar;Sin Asignar;Sin Asignar;XCMINE;MEDI;;ISM-10116;OA;2020-11-18;2020-11-18;2021-01-13;2021-01-14;2021-01-15;;-314.483;-642.188;A03;MOP;Huawei;OA;OA Completado;2021-01-15;;2021-01-13;2021-01-13;2021-01-13;2021-01-15;2021-01-13
19814;A03-S302;Cordoba Ferial II (Mudanza);NB_IOT;Sin Asignar;Sin Asignar;Sin Asignar;XCFERI;MEDI;;ISM-10117;OA;2020-11-18;2020-11-18;2021-01-11;2021-01-12;2021-01-12;;-313.707;-642.602;A03;MOP;Huawei;OA;OA Completado;2021-01-12;;2021-01-05;2021-01-11;2021-01-11;2021-01-12;2021-01-11
19817;A03-S139;Cordoba Lequipe;NB_IOT;Sin Asignar;Sin Asignar;Sin Asignar;XCLEQU;MEDI;;ISM-10120;OA;2020-11-17;2020-11-17;2021-01-05;2021-01-06;2021-01-12;;-313.426;-642.111;A03;MOP;Huawei;OA;OA Completado;2021-01-12;;2021-01-05;2021-01-05;2021-01-06;2021-01-12;2021-01-06
19820;A03-S261;Cordoba Lomas De La Carolina;NB_IOT;Sin Asignar;Sin Asignar;Sin Asignar;XCLCAR;MEDI;;ISM-10123;OA;2020-11-18;2020-11-18;2021-01-22;2021-01-22;2021-01-25;;-313.568;-64.315;A03;MOP;Huawei;OA;OA Completado;2021-01-25;;2021-01-22;2021-01-22;2021-01-22;2021-01-25;2021-01-22
19822;A03-S304;Cordoba Parque Velez Sarsfield;NB_IOT;Sin Asignar;Sin Asignar;Sin Asignar;XCVSAR;MEDI;;ISM-10125;OA;2020-11-18;2020-11-18;2021-01-28;2021-01-28;2021-01-28;;-314.373;-642.048;A03;MOP;Huawei;OA;OA Completado;2021-01-28;;2021-01-28;2021-01-28;2021-01-28;2021-01-28;2021-01-28
19826;A03-S286;Cordoba Obispo Salguero;NB_IOT;Sin Asignar;Sin Asignar;Sin Asignar;XCSALG;MEDI;;ISM-10129;OA;2020-11-18;2020-11-18;2021-01-28;2021-01-28;2021-01-28;;-314.265;-641.827;A03;MOP;Huawei;OA;OA Completado;2021-01-28;;2021-01-28;2021-01-28;2021-01-28;2021-01-28;2021-01-28
19827;A03-S206;Cordoba Villa Cornu;NB_IOT;Sin Asignar;Sin Asignar;Sin Asignar;XCCORN;MEDI;;ISM-10130;OA;2020-11-17;2020-11-17;2021-01-21;2021-01-22;2021-01-22;;-313.072;-642.777;A03;MOP;Huawei;OA;OA Completado;2021-01-22;;2021-01-21;2021-01-21;2021-01-22;2021-01-22;2021-01-22
19828;A03-S335;Cordoba Maipu;NB_IOT;Sin Asignar;Sin Asignar;Sin Asignar;XCMAIP;MEDI;;ISM-10131;OA;2020-11-18;2020-11-18;2021-01-13;2021-01-14;2021-01-15;;-314.329;-641.579;A03;MOP;Huawei;OA;OA Completado;2021-01-17;;2021-01-13;2021-01-13;2021-01-13;2021-01-17;2021-01-13
19831;A03-S735;Cordoba Cartel San Isidro;NB_IOT;Sin Asignar;Sin Asignar;Sin Asignar;XCCSAN;MEDI;;ISM-10134;OA;2020-11-20;2020-11-20;2021-01-28;2021-01-28;2021-01-28;;;;;MOP;Huawei;OA;OA Completado;2021-01-28;;2021-01-28;2021-01-28;2021-01-28;2021-01-28;2021-01-28
19835;CPU308;Los Dos Chinos 2;NB_IOT;JUAN PABLO;PIANELLO;J. PIANELLO;C2C2;AMBA;;ISM-10244;OA;2020-11-18;2020-11-18;2021-10-26;2021-10-28;2021-10-29;;-346.258;-583.759;CPU;MOP;Huawei;OA;OA Completado;2021-10-05;;2021-09-30;2021-09-30;2021-10-05;2021-10-05;2021-10-30
19836;CPU025;8 De Octubre;NB_IOT;JUAN PABLO;PIANELLO;J. PIANELLO;C8OC;AMBA;;ISM-10245;OA;2020-11-17;2020-11-17;2021-10-26;2021-10-28;2021-10-29;;-345.985;-583.873;CPU;MOP;Huawei;OA;OA Completado;2021-10-05;;2021-09-29;2021-09-29;2021-09-30;2021-10-05;2021-09-30
19837;CPU236;9 De Julio;NB_IOT;Sin Asignar;Sin Asignar;Sin Asignar;C9JU;AMBA;;ISM-10246;OA;2020-11-18;2020-11-18;2021-01-13;2021-01-14;2021-01-15;;-346.215;-583.818;CPU;MOP;Huawei;OA;OA Completado;2021-01-15;;2021-01-13;2021-01-13;2021-01-13;2021-01-15;2021-01-13
19838;CPU269;Amancio Alcorta;NB_IOT;Sin Asignar;Sin Asignar;Sin Asignar;CAAL;AMBA;;ISM-10247;OA;2020-11-18;2020-11-18;2021-01-27;2021-01-27;2021-01-28;;-346.482;-584.043;CPU;MOP;Huawei;OA;OA Completado;2021-01-27;;2021-01-27;2021-01-27;2021-01-27;2021-01-27;2021-01-27
19839;CPU475;Almagro Don Bosco;NB_IOT;JUAN PABLO;PIANELLO;J. PIANELLO;CABOSC;AMBA;;ISM-10248;OA;2020-11-19;2020-11-19;2021-10-26;2021-10-28;2021-10-29;;;;;MOP;Huawei;OA;OA Completado;2021-10-05;;2021-10-01;2021-10-01;2021-10-05;2021-10-05;2021-09-30
19840;CPU406;Almagro Centro;NB_IOT;MATIAS EZEQUIEL;COSENTINO;M. COSENTINO;CAGC;AMBA;;ISM-10249;OA;2020-11-18;2020-11-18;2021-02-17;2021-03-04;2021-03-05;;-346.115;-584.216;CPU;MOP;Huawei;OA;OA Completado;2021-03-08;;2021-02-10;2021-02-10;2021-02-12;2021-03-08;2021-02-12
19841;CPU679;AUSA Gral. Paz;NB_IOT;MATIAS EZEQUIEL;COSENTINO;M. COSENTINO;CAGPTP;AMBA;;ISM-10250;OA;2020-11-19;2020-11-19;2021-02-17;2021-03-04;2021-03-05;;-345.347;-584.636;CPU;MOP;Huawei;OA;OA Completado;2021-03-08;;2021-02-18;2021-02-18;2021-02-18;2021-03-08;2021-02-18
19842;CPU464;Artes Graficas Rioplatenses;NB_IOT;JUAN PABLO;PIANELLO;J. PIANELLO;CAGR;AMBA;;ISM-10251;OA;2020-11-19;2020-11-19;2021-10-26;2021-10-28;2021-10-29;;-346.496;-584.244;CPU;MOP;Huawei;OA;OA Completado;2021-10-05;;2021-09-30;2021-09-30;2021-10-05;2021-10-05;2021-09-30
19844;CPU274;Argentinos Juniors;NB_IOT;MATIAS EZEQUIEL;COSENTINO;M. COSENTINO;CAJU;AMBA;;ISM-10253;OA;2020-11-18;2020-11-18;2021-02-17;2021-03-04;2021-03-05;;-346.051;-584.724;CPU;MOP;Huawei;OA;OA Completado;2021-03-08;;2021-02-11;2021-02-11;2021-02-11;2021-03-08;2021-02-11
19845;CPU494;Alberdi Este;NB_IOT;JUAN PABLO;PIANELLO;J. PIANELLO;CALBEE;AMBA;;ISM-10254;OA;2020-11-19;2020-11-19;2021-10-26;2021-10-28;2021-10-29;;-346.219;-584.284;CPU;MOP;Huawei;OA;OA Completado;2021-10-05;;2021-10-01;2021-10-01;2021-10-05;2021-10-05;2021-09-30
19846;CPU070;Alcorta;NB_IOT;JUAN PABLO;PIANELLO;J. PIANELLO;CALC;AMBA;;ISM-10255;OA;2020-11-17;2020-11-17;2021-10-26;2021-10-28;2021-10-29;;-345.727;-584.042;CPU;MOP;Huawei;OA;OA Completado;2021-10-05;;2021-09-29;2021-09-29;2021-09-30;2021-10-05;2021-09-30
19847;CPU177;Alberdi;NB_IOT;JUAN PABLO;PIANELLO;J. PIANELLO;CALD;AMBA;;ISM-10256;OA;2020-11-18;2020-11-18;2021-10-26;2021-10-28;2021-10-29;;-346.626;-585.102;CPU;MOP;Huawei;OA;OA Completado;2021-10-05;;2021-09-30;2021-09-30;2021-10-05;2021-10-05;2021-09-30
19848;CPU263;Almagro;NB_IOT;JUAN PABLO;PIANELLO;J. PIANELLO;CALM;AMBA;;ISM-10257;OA;2020-11-18;2020-11-18;2021-10-26;2021-10-28;2021-10-29;;-346.205;-584.234;CPU;MOP;Huawei;OA;OA Completado;2021-10-05;;2021-09-30;2021-09-30;2021-10-05;2021-10-05;2021-09-30
19849;CPU162;Albariño;NB_IOT;Sin Asignar;Sin Asignar;Sin Asignar;CALN;AMBA;;ISM-10258;OA;2020-11-18;2020-11-18;2021-01-21;2021-01-22;2021-01-22;;-346.478;-584.995;CPU;MOP;Huawei;OA;OA Completado;2021-01-22;;2021-01-21;2021-01-21;2021-01-21;2021-01-22;2021-01-21
19851;CPU400;Alsina;NB_IOT;JUAN PABLO;PIANELLO;J. PIANELLO;CALS;AMBA;;ISM-10260;OA;2020-11-18;2020-11-18;2021-10-26;2021-10-28;2021-10-29;;-346.121;-583.926;CPU;MOP;Huawei;OA;OA Completado;2021-10-05;;2021-09-30;2021-09-30;2021-10-05;2021-10-05;2021-09-30
19852;CPU820;Alvear Palace Hotel;NB_IOT;JUAN PABLO;PIANELLO;J. PIANELLO;CALVPH;AMBA;;ISM-10261;OA;2020-11-19;2020-11-19;2021-10-26;2021-10-28;2021-10-29;;;;;MOP;Huawei;OA;OA Completado;2021-10-05;;2021-10-01;2021-10-01;2021-10-05;2021-10-05;2021-09-30
19853;CPU131;Ambrosetti;NB_IOT;JUAN PABLO;PIANELLO;J. PIANELLO;CAMB;AMBA;;ISM-10262;OA;2020-11-18;2020-11-18;2021-10-26;2021-10-28;2021-10-29;;-346.128;-584.379;CPU;MOP;Huawei;OA;OA Completado;2021-10-05;;2021-09-30;2021-09-30;2021-10-05;2021-10-05;2021-09-30
19854;CPU027;Amia;NB_IOT;JUAN PABLO;PIANELLO;J. PIANELLO;CAMI;AMBA;;ISM-10263;RFI;17/11/2020 13:03;17/11/2020 13:03;;;;;-346.026;-583.972;CPU;MOP;Huawei;OA;OA Completado;2021-10-05;;2021-09-29;2021-09-29;2021-09-30;2021-10-05;2021-09-30
19855;CPU680;AUSA Parque Avellaneda;NB_IOT;JUAN PABLO;PIANELLO;J. PIANELLO;CAPATP;AMBA;;ISM-10264;OA;19/11/2020 12:18;19/11/2020 12:18;26/10/2021 17:37;28/10/2021 20:30;29/10/2021 10:32;;-346.488;-584.747;CPU;MOP;Huawei;OA;OA Completado;2021-10-05;;2021-10-01;2021-10-01;2021-10-05;2021-10-05;2021-09-30
19856;CPU061;Aeroparque;NB_IOT;Sin Asignar;Sin Asignar;Sin Asignar;CAPQ;AMBA;;ISM-10265;OA;17/11/2020 14:01;17/11/2020 14:01;21/1/2021 18:02;22/1/2021 10:45;22/1/2021 13:09;;-345.565;-58.414;CPU;MOP;Huawei;OA;OA Completado;2021-01-22;;2021-01-21;2021-01-21;2021-01-21;2021-01-22;2021-01-21
19857;CPU126;Aranguren;NB_IOT;Sin Asignar;Sin Asignar;Sin Asignar;CARA;AMBA;;ISM-10266;OA;18/11/2020 09:54;18/11/2020 09:54;21/1/2021 18:04;22/1/2021 10:50;22/1/2021 13:09;;-346.252;-584.717;CPU;MOP;Huawei;OA;OA Completado;2021-01-22;;2021-01-21;2021-01-21;2021-01-21;2021-01-22;2021-01-21
19858;CPU682;Ausa Riachuelo;NB_IOT;JUAN PABLO;PIANELLO;J. PIANELLO;CARLTP;AMBA;;ISM-10267;OA;19/11/2020 12:20;19/11/2020 12:20;26/10/2021 17:37;28/10/2021 19:48;29/10/2021 10:34;;-346.732;-58.436;CPU;MOP;Huawei;OA;OA Completado;2021-10-05;;2021-10-01;2021-10-01;2021-10-05;2021-10-05;2021-09-30
19859;CPU681;AUSA Terminal Dellepiane;NB_IOT;Sin Asignar;Sin Asignar;Sin Asignar;CATDEL;AMBA;;ISM-10268;OA;19/11/2020 12:18;19/11/2020 12:18;11/1/2021 16:12;12/1/2021 09:29;12/1/2021 16:41;;-346.511;-58.466;CPU;MOP;Huawei;OA;OA Completado;2021-01-12;;2021-01-05;2021-01-11;2021-01-11;2021-01-12;2021-01-11
19860;CPU057;Atlas;NB_IOT;JUAN PABLO;PIANELLO;J. PIANELLO;CATL;AMBA;;ISM-10269;OA;17/11/2020 13:59;17/11/2020 13:59;26/10/2021 17:37;28/10/2021 19:00;29/10/2021 10:39;;-345.596;-584.604;CPU;MOP;Huawei;OA;OA Completado;2021-10-05;;2021-09-29;2021-09-29;2021-09-30;2021-10-05;2021-09-30
19861;CPU165;Av. Del Trabajo;NB_IOT;JUAN PABLO;PIANELLO;J. PIANELLO;CATR;AMBA;;ISM-10270;OA;18/11/2020 10:11;18/11/2020 10:11;26/10/2021 17:37;28/10/2021 20:01;29/10/2021 10:34;;-346.465;-584.621;CPU;MOP;Huawei;OA;OA Completado;2021-10-05;;2021-09-30;2021-09-30;2021-10-05;2021-10-05;2021-09-30
19862;CPU180;Autodromo;NB_IOT;Sin Asignar;Sin Asignar;Sin Asignar;CAUM;AMBA;;ISM-10271;OA;18/11/2020 10:16;18/11/2020 10:16;21/1/2021 13:14;22/1/2021 12:33;25/1/2021 14:01;;-346.958;-584.722;CPU;MOP;Huawei;OA;OA Completado;2021-01-25;;2021-01-21;2021-01-21;2021-01-22;2021-01-25;2021-01-22
19863;CPU408;Bacacay;NB_IOT;MATIAS EZEQUIEL;COSENTINO;M. COSENTINO;CBCY;AMBA;;ISM-10272;OA;18/11/2020 15:51;18/11/2020 15:51;17/2/2021 23:53;4/3/2021 16:07;5/3/2021 18:44;;-346.294;-584.735;CPU;MOP;Huawei;OA;OA Completado;2021-03-08;;2021-02-10;2021-02-10;2021-02-12;2021-03-08;2021-02-12
19864;CPU106;Batalla De Pari;NB_IOT;JUAN PABLO;PIANELLO;J. PIANELLO;CBDP;AMBA;;ISM-10273;OA;18/11/2020 09:24;18/11/2020 09:24;26/10/2021 17:39;28/10/2021 20:46;29/10/2021 10:30;;-345.995;-584.523;CPU;MOP;Huawei;OA;OA Completado;2021-10-05;;2021-09-29;2021-09-29;2021-09-30;2021-10-05;2021-09-30
19865;CPU135;Belgrano;NB_IOT;JUAN PABLO;PIANELLO;J. PIANELLO;CBEL;AMBA;;ISM-10274;OA;18/11/2020 09:58;18/11/2020 09:58;26/10/2021 17:37;28/10/2021 20:26;29/10/2021 10:32;;-346.159;-584.176;CPU;MOP;Huawei;OA;OA Completado;2021-10-05;;2021-09-30;2021-09-30;2021-10-05;2021-10-05;2021-09-30
19866;CPU290;Bajo Flores;NB_IOT;JUAN PABLO;PIANELLO;J. PIANELLO;CBFL;AMBA;;ISM-10275;OA;18/11/2020 14:53;18/11/2020 14:53;26/10/2021 17:37;28/10/2021 18:54;29/10/2021 10:39;;-346.429;-584.478;CPU;MOP;Huawei;OA;OA Completado;2021-10-05;;2021-09-30;2021-09-30;2021-10-05;2021-10-05;2021-09-30
19867;CPU224;Barrio Gral Savio;NB_IOT;Sin Asignar;Sin Asignar;Sin Asignar;CBGSTP;AMBA;;ISM-10276;OA;18/11/2020 13:52;18/11/2020 13:52;22/1/2021 12:15;25/1/2021 15:13;25/1/2021 15:18;;-346.854;-584.606;CPU;MOP;Huawei;OA;OA Completado;2021-01-25;;2021-01-20;2021-01-22;2021-01-25;2021-01-25;2021-01-25
19868;CPU240;Billinghurst;NB_IOT;MATIAS EZEQUIEL;COSENTINO;M. COSENTINO;CBLL;AMBA;;ISM-10277;OA;18/11/2020 13:57;18/11/2020 13:57;17/2/2021 23:53;3/3/2021 14:42;5/3/2021 18:51;;-346.033;-584.153;CPU;MOP;Huawei;OA;OA Completado;2021-03-08;;2021-02-10;2021-02-10;2021-02-12;2021-03-08;2021-02-12
19869;CPU734;Cv Liniers;NB_IOT;JUAN PABLO;PIANELLO;J. PIANELLO;CBLNRS;AMBA;;ISM-10278;OA;19/11/2020 13:18;19/11/2020 13:18;26/10/2021 17:37;28/10/2021 19:12;29/10/2021 10:38;;-34.643;-58.521;CPU;MOP;Huawei;OA;OA Completado;2021-10-05;;2021-10-01;2021-10-01;2021-10-05;2021-10-05;2021-09-30
19870;CPU138;Bolivar;NB_IOT;Sin Asignar;Sin Asignar;Sin Asignar;CBLV;AMBA;;ISM-10279;OA;18/11/2020 09:58;18/11/2020 09:58;21/1/2021 13:27;21/1/2021 14:26;25/1/2021 11:30;;-346.184;-583.725;CPU;MOP;Huawei;OA;OA Completado;2021-01-25;;2021-01-21;2021-01-21;2021-01-21;2021-01-25;2021-01-21
19871;CPU284;Ace Botanico;NB_IOT;MATIAS EZEQUIEL;COSENTINO;M. COSENTINO;CBOC;AMBA;;ISM-10280;OA;18/11/2020 14:51;18/11/2020 14:51;17/2/2021 23:53;4/3/2021 15:49;5/3/2021 18:45;;-345.807;-584.082;CPU;MOP;Huawei;OA;OA Completado;2021-03-08;;2021-02-18;2021-02-18;2021-02-18;2021-03-08;2021-02-18
19872;CPU154;Boedo;NB_IOT;JUAN PABLO;PIANELLO;J. PIANELLO;CBOE;AMBA;;ISM-10281;OA;18/11/2020 10:07;18/11/2020 10:07;26/10/2021 17:39;28/10/2021 21:13;29/10/2021 10:25;;-346.323;-584.299;CPU;MOP;Huawei;OA;OA Completado;2021-10-05;;2021-09-30;2021-09-30;2021-10-05;2021-10-05;2021-09-30
19873;CPU082;Botanico;NB_IOT;MATIAS EZEQUIEL;COSENTINO;M. COSENTINO;CBOT;AMBA;;ISM-10282;OA;17/11/2020 14:08;17/11/2020 14:08;17/2/2021 23:53;4/3/2021 16:11;5/3/2021 18:44;;-34.583;-584.192;CPU;MOP;Huawei;OA;OA Completado;2021-03-08;;2021-02-12;2021-02-12;2021-02-12;2021-03-08;2021-02-12
19874;CPU128;Boyaca;NB_IOT;MATIAS EZEQUIEL;COSENTINO;M. COSENTINO;CBOY;AMBA;;ISM-10283;OA;18/11/2020 09:54;18/11/2020 09:54;17/2/2021 23:51;4/3/2021 15:45;5/3/2021 18:47;;-346.224;-584.604;CPU;MOP;Huawei;OA;OA Completado;2021-03-08;;2021-02-18;2021-02-18;2021-02-18;2021-03-08;2021-02-18
19875;CPU503;Barrio Piedrabuena Norte;NB_IOT;JUAN PABLO;PIANELLO;J. PIANELLO;CBPN;AMBA;;ISM-10284;OA;19/11/2020 10:59;19/11/2020 10:59;26/10/2021 17:39;28/10/2021 21:09;29/10/2021 10:27;;-346.769;-584.897;CPU;MOP;Huawei;OA;OA Completado;2021-10-05;;2021-10-01;2021-10-01;2021-10-05;2021-10-05;2021-09-30
19876;CPU401;Caba 2014 - 21;NB_IOT;JUAN PABLO;PIANELLO;J. PIANELLO;CBPQ;AMBA;;ISM-10285;OA;18/11/2020 15:49;18/11/2020 15:49;26/10/2021 17:37;28/10/2021 20:08;29/10/2021 10:32;;-345.798;-583.993;CPU;MOP;Huawei;OA;OA Completado;2021-10-05;;2021-09-30;2021-09-30;2021-10-05;2021-10-05;2021-09-30
19877;CPU322;Barracas 2;NB_IOT;JUAN PABLO;PIANELLO;J. PIANELLO;CBR2;AMBA;;ISM-10286;OA;18/11/2020 15:06;18/11/2020 15:06;26/10/2021 17:37;28/10/2021 19:54;29/10/2021 10:34;;-346.446;-583.788;CPU;MOP;Huawei;OA;OA Completado;2021-10-05;;2021-09-30;2021-09-30;2021-10-05;2021-10-05;2021-10-30
19878;CPU023;Embajada Brasil;NB_IOT;Sin Asignar;Sin Asignar;Sin Asignar;CBRA;AMBA;;ISM-10287;OA;17/11/2020 13:00;17/11/2020 13:00;22/1/2021 13:09;22/1/2021 15:17;25/1/2021 10:16;;-345.942;-583.838;CPU;MOP;Huawei;OA;OA Completado;2021-01-25;;2021-01-22;2021-01-22;2021-01-22;2021-01-25;2021-01-22
19879;CPU451;Barracas Este;NB_IOT;Sin Asignar;Sin Asignar;Sin Asignar;CBRE;AMBA;;ISM-10288;OA;19/11/2020 10:20;19/11/2020 10:20;11/1/2021 16:09;12/1/2021 09:24;12/1/2021 16:34;;-346.476;-583.686;CPU;MOP;Huawei;OA;OA Completado;2021-01-12;;2021-01-05;2021-01-11;2021-01-11;2021-01-12;2021-01-11
19880;CPU650;Bucarelli;NB_IOT;SEBASTIAN;ANGELERI;S. ANGELERI;CBUC;AMBA;;ISM-10289;OA;19/11/2020 12:09;19/11/2020 12:09;26/10/2021 17:37;28/10/2021 19:25;29/10/2021 10:36;;-34.588;-584.774;CPU;MOP;Huawei;OA;OA Completado;2021-10-06;;2021-10-01;2021-10-01;2021-10-05;2021-10-06;2021-09-30
19882;CPU001;Calle 15;NB_IOT;JUAN PABLO;PIANELLO;J. PIANELLO;CC15;AMBA;;ISM-10292;OA;17/11/2020 12:27;17/11/2020 12:27;26/10/2021 17:37;28/10/2021 20:06;29/10/2021 10:32;;-345.818;-583.758;CPU;MOP;Huawei;OA;OA Completado;2021-10-05;;2021-09-29;2021-09-29;2021-09-30;2021-10-05;2021-09-30
19883;CPU134;Caballito 2;NB_IOT;JUAN PABLO;PIANELLO;J. PIANELLO;CCAB;AMBA;;ISM-10293;OA;18/11/2020 09:58;18/11/2020 09:58;26/10/2021 17:39;28/10/2021 21:02;29/10/2021 10:27;;-346.132;-584.255;CPU;MOP;Huawei;OA;OA Completado;2021-10-05;;2021-09-30;2021-09-30;2021-10-05;2021-10-05;2021-09-30
19884;CPU533;Carrefour Agronomia;NB_IOT;JUAN PABLO;PIANELLO;J. PIANELLO;CCAG;AMBA;;ISM-10294;OA;19/11/2020 11:05;19/11/2020 11:05;26/10/2021 17:39;28/10/2021 20:57;29/10/2021 10:29;;-345.952;-584.748;CPU;MOP;Huawei;OA;OA Completado;2021-10-05;;2021-10-01;2021-10-01;2021-10-05;2021-10-05;2021-09-30
19885;CPU014;Camara;NB_IOT;Sin Asignar;Sin Asignar;Sin Asignar;CCAM;AMBA;;ISM-10295;OA;17/11/2020 12:49;17/11/2020 12:49;28/9/2021 10:27;27/10/2021 12:18;29/10/2021 10:39;;-346.068;-583.705;CPU;MOP;Huawei;OA;OA Completado;2021-09-28;;2021-09-28;2021-09-28;2021-09-28;2021-09-28;2021-09-30
19886;CPU054;Capdevila;NB_IOT;JUAN PABLO;PIANELLO;J. PIANELLO;CCAP;AMBA;;ISM-10296;OA;17/11/2020 13:57;17/11/2020 13:57;26/10/2021 17:37;28/10/2021 19:43;29/10/2021 10:36;;-345.692;-584.905;CPU;MOP;Huawei;OA;OA Completado;2021-10-05;;2021-09-29;2021-09-29;2021-10-05;2021-10-05;2021-09-30
19887;CPU232;Cazadores;NB_IOT;JUAN PABLO;PIANELLO;J. PIANELLO;CCAZ;AMBA;;ISM-10297;OA;18/11/2020 13:54;18/11/2020 13:54;26/10/2021 17:39;28/10/2021 21:00;29/10/2021 10:27;;-345.549;-584.438;CPU;MOP;Huawei;OA;OA Completado;2021-10-05;;2021-09-30;2021-09-30;2021-10-05;2021-10-05;2021-09-30
19888;CPU219;Corporacion Buenos Aires Sur;NB_IOT;Sin Asignar;Sin Asignar;Sin Asignar;CCBATP;AMBA;;ISM-10298;OA;18/11/2020 13:45;18/11/2020 13:45;22/1/2021 09:24;22/1/2021 10:59;25/1/2021 12:29;;-34.666;-584.387;CPU;MOP;Huawei;OA;OA Completado;2021-01-25;;2021-01-20;2021-01-22;2021-01-22;2021-01-25;2021-01-22
19890;CPU141;Carlos Calvo;NB_IOT;JUAN PABLO;PIANELLO;J. PIANELLO;CCCV;AMBA;;ISM-10300;OA;18/11/2020 10:02;18/11/2020 10:02;26/10/2021 17:39;28/10/2021 21:02;29/10/2021 10:27;;-346.252;-58.425;CPU;MOP;Huawei;OA;OA Completado;2021-10-05;;2021-09-30;2021-09-30;2021-10-05;2021-10-05;2021-09-30
19891;CPU220;Cinco Esquinas;NB_IOT;SEBASTIAN;ANGELERI;S. ANGELERI;CCEQ;AMBA;;ISM-10301;OA;18/11/2020 13:50;18/11/2020 13:50;26/10/2021 17:39;28/10/2021 20:57;29/10/2021 10:29;;-346.581;-584.789;CPU;MOP;Huawei;OA;OA Completado;2021-10-06;;2021-09-30;2021-09-30;2021-10-05;2021-10-06;2021-09-30
19893;CPU307;Charcas 2;NB_IOT;MATIAS EZEQUIEL;COSENTINO;M. COSENTINO;CCH2;AMBA;;ISM-10303;OA;18/11/2020 14:57;18/11/2020 14:57;17/2/2021 23:51;4/3/2021 15:27;5/3/2021 18:49;;-345.927;-584.135;CPU;MOP;Huawei;OA;OA Completado;2021-03-08;;2021-02-10;2021-02-10;2021-02-12;2021-03-08;2021-02-12
19894;CPU362;Charcas 3;NB_IOT;JUAN PABLO;PIANELLO;J. PIANELLO;CCH3;AMBA;;ISM-10304;OA;18/11/2020 15:27;18/11/2020 15:27;26/10/2021 17:39;28/10/2021 21:22;29/10/2021 10:25;;-345.927;-584.093;CPU;MOP;Huawei;OA;OA Completado;2021-10-05;;2021-09-30;2021-09-30;2021-10-05;2021-10-05;2021-09-30
19895;CPU089;Chacarita;NB_IOT;JUAN PABLO;PIANELLO;J. PIANELLO;CCHC;AMBA;;ISM-10305;OA;17/11/2020 14:10;17/11/2020 14:10;26/10/2021 17:39;28/10/2021 21:02;29/10/2021 10:27;;-345.856;-584.531;CPU;MOP;Huawei;OA;OA Completado;2021-10-05;;2021-09-29;2021-09-29;2021-09-30;2021-10-05;2021-09-30
19896;CPU137;Chile;NB_IOT;JUAN PABLO;PIANELLO;J. PIANELLO;CCHI;AMBA;;ISM-10306;OA;18/11/2020 09:58;18/11/2020 09:58;26/10/2021 17:39;28/10/2021 21:11;29/10/2021 10:27;;-346.151;-583.796;CPU;MOP;Huawei;OA;OA Completado;2021-10-05;;2021-09-30;2021-09-30;2021-10-05;2021-10-05;2021-09-30
19897;CPU616;Chacarita Norte;NB_IOT;JUAN PABLO;PIANELLO;J. PIANELLO;CCHN;AMBA;;ISM-10307;OA;19/11/2020 12:04;19/11/2020 12:04;26/10/2021 17:39;28/10/2021 20:57;29/10/2021 10:29;;-345.791;-584.563;CPU;MOP;Huawei;OA;OA Completado;2021-10-05;;2021-10-01;2021-10-01;2021-10-05;2021-10-05;2021-09-30
19898;CPU228;Chivilcoy;NB_IOT;MATIAS EZEQUIEL;COSENTINO;M. COSENTINO;CCHY;AMBA;;ISM-10308;OA;18/11/2020 13:52;18/11/2020 13:52;17/2/2021 23:53;4/3/2021 16:16;5/3/2021 18:42;;-345.951;-585.085;CPU;MOP;Huawei;OA;OA Completado;2021-03-08;;2021-02-18;2021-02-18;2021-02-18;2021-03-08;2021-02-18
19899;CPU116;Cid Campeador;NB_IOT;JUAN PABLO;PIANELLO;J. PIANELLO;CCID;AMBA;;ISM-10309;OA;18/11/2020 09:49;18/11/2020 09:49;26/10/2021 17:39;28/10/2021 21:09;29/10/2021 10:27;;-346.086;-584.495;CPU;MOP;Huawei;OA;OA Completado;2021-10-05;;2021-09-30;2021-09-30;2021-10-05;2021-10-05;2021-09-30
19900;CPU222;Ciudad Oculta;NB_IOT;MATIAS EZEQUIEL;COSENTINO;M. COSENTINO;CCIO;AMBA;;ISM-10310;OA;18/11/2020 13:50;18/11/2020 13:50;17/2/2021 23:53;4/3/2021 16:14;5/3/2021 18:42;;-346.701;-584.887;CPU;MOP;Huawei;OA;OA Completado;2021-03-08;;2021-02-18;2021-02-18;2021-02-18;2021-03-08;2021-02-18
19901;CPU044;Club Ciudad;NB_IOT;JUAN PABLO;PIANELLO;J. PIANELLO;CCIU;AMBA;;ISM-10311;OA;17/11/2020 13:52;17/11/2020 13:52;26/10/2021 17:37;28/10/2021 19:30;29/10/2021 10:36;;-34.543;-584.584;CPU;MOP;Huawei;OA;OA Completado;2021-10-05;;2021-09-29;2021-09-29;2021-09-30;2021-10-05;2021-09-30
19902;CPU393;Club Liniers;NB_IOT;JUAN PABLO;PIANELLO;J. PIANELLO;CCLI;AMBA;;ISM-10312;OA;18/11/2020 15:47;18/11/2020 15:47;26/10/2021 17:39;28/10/2021 21:08;29/10/2021 10:27;;-346.435;-585.255;CPU;MOP;Huawei;OA;OA Completado;2021-10-05;;2021-09-30;2021-09-30;2021-10-05;2021-10-05;2021-09-30
19903;CPU532;Carrefour Mataderos;NB_IOT;Sin Asignar;Sin Asignar;Sin Asignar;CCMT;AMBA;;ISM-10313;OA;19/11/2020 11:05;19/11/2020 11:05;11/1/2021 14:55;12/1/2021 09:13;12/1/2021 16:30;;-346.638;-585.145;CPU;MOP;Huawei;OA;OA Completado;2021-01-12;;2021-01-05;2021-01-11;2021-01-11;2021-01-12;2021-01-11
19904;CPU409;Cachimayo;NB_IOT;MATIAS EZEQUIEL;COSENTINO;M. COSENTINO;CCMY;AMBA;;ISM-10314;OA;18/11/2020 15:51;18/11/2020 15:51;17/2/2021 23:53;4/3/2021 16:09;5/3/2021 18:44;;-346.245;-584.419;CPU;MOP;Huawei;OA;OA Completado;2021-03-08;;2021-02-17;2021-02-17;2021-02-17;2021-03-08;2021-02-17
19905;CPU617;Conde;NB_IOT;JUAN PABLO;PIANELLO;J. PIANELLO;CCNDTP;AMBA;;ISM-10315;OA;19/11/2020 12:06;19/11/2020 12:06;26/10/2021 17:39;28/10/2021 21:00;29/10/2021 10:27;;-345.771;-584.517;CPU;MOP;Huawei;OA;OA Completado;2021-10-05;;2021-10-01;2021-10-01;2021-10-05;2021-10-05;2021-09-30
19906;CPU246;Costanera Norte;NB_IOT;JUAN PABLO;PIANELLO;J. PIANELLO;CCNO;AMBA;;ISM-10316;OA;18/11/2020 13:59;18/11/2020 13:59;26/10/2021 17:37;28/10/2021 20:39;29/10/2021 10:30;;-345.499;-584.308;CPU;MOP;Huawei;OA;OA Completado;2021-10-05;;2021-09-30;2021-09-30;2021-10-05;2021-10-05;2021-09-30
19907;CPU276;Constitucion 2;NB_IOT;JUAN PABLO;PIANELLO;J. PIANELLO;CCO2;AMBA;;ISM-10317;OA;18/11/2020 14:51;18/11/2020 14:51;26/10/2021 17:37;28/10/2021 19:50;29/10/2021 10:34;;-346.249;-583.901;CPU;MOP;Huawei;OA;OA Completado;2021-10-05;;2021-09-30;2021-09-30;2021-10-05;2021-10-05;2021-09-30
19908;CPU107;Crespo;NB_IOT;JUAN PABLO;PIANELLO;J. PIANELLO;CCRE;AMBA;;ISM-10318;OA;18/11/2020 09:27;18/11/2020 09:27;26/10/2021 17:39;28/10/2021 21:00;29/10/2021 10:27;;-346.014;-584.407;CPU;MOP;Huawei;OA;OA Completado;2021-10-05;;2021-09-29;2021-09-29;2021-09-30;2021-10-05;2021-09-30
19909;CPU011;Correo;NB_IOT;MATIAS EZEQUIEL;COSENTINO;M. COSENTINO;CCRR;AMBA;;ISM-10319;OA;17/11/2020 12:47;17/11/2020 12:47;11/2/2021 10:41;3/3/2021 12:00;5/3/2021 18:53;;-346.031;-583.707;CPU;MOP;Huawei;OA;OA Completado;2021-03-08;;2021-02-11;2021-02-11;2021-02-11;2021-03-08;2021-02-11
19910;CPU149;Carrasco;NB_IOT;JUAN PABLO;PIANELLO;J. PIANELLO;CCRS;AMBA;;ISM-10320;OA;18/11/2020 10:05;18/11/2020 10:05;26/10/2021 17:37;28/10/2021 19:57;29/10/2021 10:34;;-346.339;-584.891;CPU;MOP;Huawei;OA;OA Completado;2021-10-05;;2021-09-30;2021-09-30;2021-10-05;2021-10-05;2021-09-30
19911;CPU323;Clarin Sede Central;NB_IOT;MATIAS EZEQUIEL;COSENTINO;M. COSENTINO;CCSC;AMBA;;ISM-10321;OA;18/11/2020 15:06;18/11/2020 15:06;17/2/2021 23:53;4/3/2021 15:49;5/3/2021 18:45;;-346.293;-583.746;CPU;MOP;Huawei;OA;OA Completado;2021-03-08;;2021-02-17;2021-02-17;2021-02-17;2021-03-08;2021-02-17
19912;CPU317;Catalinas Sur;NB_IOT;SEBASTIAN;ANGELERI;S. ANGELERI;CCTS;AMBA;;ISM-10322;RFA;18/11/2020 15:00;18/11/2020 15:00;26/10/2021 17:39;;;;-345.988;-583.713;CPU;MOP;Huawei;OA;OA Completado;2021-10-06;;2021-09-30;2021-09-30;2021-10-05;2021-10-06;2021-10-30
19913;CPU086;Constituyentes;NB_IOT;Sin Asignar;Sin Asignar;Sin Asignar;CCTY;AMBA;;ISM-10323;OA;17/11/2020 14:10;17/11/2020 14:10;3/2/2021 17:21;4/2/2021 08:21;5/2/2021 13:52;;-345.894;-584.843;CPU;MOP;Huawei;OA;OA Completado;2021-02-08;;2021-02-03;2021-02-03;2021-02-03;2021-02-08;2021-02-03
19914;CPU358;Carrefour Villa Devoto;NB_IOT;JUAN PABLO;PIANELLO;J. PIANELLO;CCVD;AMBA;;ISM-10324;OA;18/11/2020 15:27;18/11/2020 15:27;26/10/2021 17:37;28/10/2021 19:59;29/10/2021 10:34;;-346.112;-585.163;CPU;MOP;Huawei;OA;OA Completado;2021-10-05;;2021-09-30;2021-09-30;2021-10-05;2021-10-05;2021-09-30
19915;CPU017;Derecho;NB_IOT;Sin Asignar;Sin Asignar;Sin Asignar;CDCH;AMBA;;ISM-10325;OA;17/11/2020 12:51;17/11/2020 12:51;13/1/2021 18:20;14/1/2021 09:20;15/1/2021 14:55;;-345.821;-58.392;CPU;MOP;Huawei;OA;OA Completado;2021-01-15;;2021-01-13;2021-01-13;2021-01-13;2021-01-15;2021-01-13
19916;CPU159;Dock Sud;NB_IOT;JUAN PABLO;PIANELLO;J. PIANELLO;CDCK;AMBA;;ISM-10326;OA;18/11/2020 10:09;18/11/2020 10:09;26/10/2021 17:37;28/10/2021 19:43;29/10/2021 10:36;;-34.634;-583.532;CPU;MOP;Huawei;OA;OA Completado;2021-10-05;;2021-09-30;2021-09-30;2021-10-05;2021-10-05;2021-09-30
19917;CPU335;Departamento Central De Policia;NB_IOT;JUAN PABLO;PIANELLO;J. PIANELLO;CDCP;AMBA;;ISM-10327;OA;18/11/2020 15:22;18/11/2020 15:22;26/10/2021 17:39;28/10/2021 21:04;29/10/2021 10:27;;-346.137;-583.874;CPU;MOP;Huawei;OA;OA Completado;2021-10-05;;2021-09-30;2021-09-30;2021-10-05;2021-10-05;2021-09-30
19918;CPU016;Defensa;NB_IOT;Sin Asignar;Sin Asignar;Sin Asignar;CDEF;AMBA;;ISM-10328;OA;17/11/2020 12:51;17/11/2020 12:51;11/1/2021 16:14;12/1/2021 09:33;12/1/2021 16:41;;-346.126;-583.721;CPU;MOP;Huawei;OA;OA Completado;2021-01-12;;2021-01-05;2021-01-11;2021-01-11;2021-01-12;2021-01-11
19919;CPU572;Deheza;NB_IOT;MATIAS EZEQUIEL;COSENTINO;M. COSENTINO;CDEHEZ;AMBA;;ISM-10329;OA;19/11/2020 11:59;19/11/2020 11:59;17/2/2021 23:53;4/3/2021 16:09;5/3/2021 18:44;;;;;MOP;Huawei;OA;OA Completado;2021-03-08;;2021-02-11;2021-02-11;2021-02-11;2021-03-08;2021-02-11
19920;CPU173;Deportivo Español;NB_IOT;JUAN PABLO;PIANELLO;J. PIANELLO;CDES;AMBA;;ISM-10330;OA;18/11/2020 10:14;18/11/2020 10:14;26/10/2021 17:37;28/10/2021 20:30;29/10/2021 10:30;;-346.585;-584.698;CPU;MOP;Huawei;OA;OA Completado;2021-10-05;;2021-09-30;2021-09-30;2021-10-05;2021-10-05;2021-09-30
19921;CPU112;Devoto;NB_IOT;JUAN PABLO;PIANELLO;J. PIANELLO;CDEV;AMBA;;ISM-10331;OA;18/11/2020 09:38;18/11/2020 09:38;26/10/2021 17:39;28/10/2021 20:57;29/10/2021 10:29;;-346.155;-58.51;CPU;MOP;Huawei;OA;OA Completado;2021-10-05;;2021-09-30;2021-09-30;2021-10-05;2021-10-05;2021-09-30
19922;CPU163;Directorio;NB_IOT;JUAN PABLO;PIANELLO;J. PIANELLO;CDIC;AMBA;;ISM-10332;OA;18/11/2020 10:11;18/11/2020 10:11;26/10/2021 17:39;28/10/2021 20:59;29/10/2021 10:27;;-346.491;-58.484;CPU;MOP;Huawei;OA;OA Completado;2021-10-05;;2021-09-30;2021-09-30;2021-10-05;2021-10-05;2021-09-30
19923;CPU304;Diagonal Norte;NB_IOT;JUAN PABLO;PIANELLO;J. PIANELLO;CDIN;AMBA;;ISM-10333;OA;18/11/2020 14:57;18/11/2020 14:57;26/10/2021 17:37;28/10/2021 19:39;29/10/2021 10:36;;-346.057;-58.377;CPU;MOP;Huawei;OA;OA Completado;2021-10-05;;2021-09-30;2021-09-30;2021-10-05;2021-10-05;2021-10-30
19924;CPU139;Dique 1;NB_IOT;MATIAS EZEQUIEL;COSENTINO;M. COSENTINO;CDIQ;AMBA;;ISM-10334;OA;18/11/2020 15:04;18/11/2020 15:04;17/2/2021 23:53;4/3/2021 16:09;5/3/2021 18:44;;-346.176;-58.368;CPU;MOP;Huawei;OA;OA Completado;2021-03-08;;2021-02-12;2021-02-12;2021-02-12;2021-03-08;2021-02-12
19925;CPU620;Calderon De La Barca 2;NB_IOT;JUAN PABLO;PIANELLO;J. PIANELLO;CDL2;AMBA;;ISM-10335;OA;19/11/2020 12:06;19/11/2020 12:06;26/10/2021 17:37;28/10/2021 19:56;29/10/2021 10:34;;-346.306;-585.032;CPU;MOP;Huawei;OA;OA Completado;2021-10-05;;2021-10-01;2021-10-01;2021-10-05;2021-10-05;2021-09-30
19926;CPU199;Solar De La Abadia;NB_IOT;JUAN PABLO;PIANELLO;J. PIANELLO;CDLA;AMBA;;ISM-10336;OA;18/11/2020 15:02;18/11/2020 15:02;26/10/2021 17:39;28/10/2021 21:11;29/10/2021 10:27;;-345.673;-584.372;CPU;MOP;Huawei;OA;OA Completado;2021-10-05;;2021-09-30;2021-09-30;2021-10-05;2021-10-05;2021-09-30
19927;CPU188;Calderon De La Barca;NB_IOT;Sin Asignar;Sin Asignar;Sin Asignar;CDLB;AMBA;;ISM-10337;OA;18/11/2020 12:53;18/11/2020 12:53;21/1/2021 12:47;21/1/2021 13:39;25/1/2021 14:08;;-34.63;-585.017;CPU;MOP;Huawei;OA;OA Completado;2021-01-25;;2021-01-21;2021-01-21;2021-01-21;2021-01-25;2021-01-21
19928;CPU068;Dorrego;NB_IOT;JUAN PABLO;PIANELLO;J. PIANELLO;CDOR;AMBA;;ISM-10338;OA;17/11/2020 14:03;17/11/2020 14:03;26/10/2021 17:37;28/10/2021 19:14;29/10/2021 10:38;;-345.696;-584.314;CPU;MOP;Huawei;OA;OA Completado;2021-10-05;;2021-09-29;2021-09-29;2021-09-30;2021-10-05;2021-09-30
19929;CPU093;Darwin;NB_IOT;JUAN PABLO;PIANELLO;J. PIANELLO;CDRN;AMBA;;ISM-10339;OA;18/11/2020 09:02;18/11/2020 09:02;26/10/2021 17:39;28/10/2021 21:09;29/10/2021 10:27;;-34.594;-584.465;CPU;MOP;Huawei;OA;OA Completado;2021-10-05;;2021-09-29;2021-09-29;2021-09-30;2021-10-05;2021-09-30
19930;CPU111;Plaza Devoto;NB_IOT;JUAN PABLO;PIANELLO;J. PIANELLO;CDTO;AMBA;;ISM-10340;OA;18/11/2020 09:38;18/11/2020 09:38;26/10/2021 17:39;28/10/2021 18:00;29/10/2021 10:39;;-346.064;-585.149;CPU;MOP;Huawei;OA;OA Completado;2021-10-05;;2021-09-30;2021-09-30;2021-10-05;2021-10-05;2021-09-30
19931;CPU368;Sanatorio Dupuytren;NB_IOT;JUAN PABLO;PIANELLO;J. PIANELLO;CDUPUY;AMBA;;ISM-10341;OA;18/11/2020 15:27;18/11/2020 15:27;26/10/2021 17:37;28/10/2021 19:23;29/10/2021 10:38;;-346.157;-584.136;CPU;MOP;Huawei;OA;OA Completado;2021-10-05;;2021-09-30;2021-09-30;2021-10-05;2021-10-05;2021-09-30
19933;CPU235;Estacion Caballito;NB_IOT;MATIAS EZEQUIEL;COSENTINO;M. COSENTINO;CECA;AMBA;;ISM-10343;OA;18/11/2020 13:54;18/11/2020 13:54;17/2/2021 23:51;4/3/2021 15:45;5/3/2021 18:47;;-346.188;-584.419;CPU;MOP;Huawei;OA;OA Completado;2021-03-08;;2021-02-10;2021-02-10;2021-02-12;2021-03-08;2021-02-12
19934;CPU376;Embajada De Dinamarca;NB_IOT;JUAN PABLO;PIANELLO;J. PIANELLO;CEDD;AMBA;;ISM-10344;OA;18/11/2020 15:31;18/11/2020 15:31;26/10/2021 17:39;28/10/2021 21:11;29/10/2021 10:27;;-345.953;-583.731;CPU;MOP;Huawei;OA;OA Completado;2021-10-05;;2021-09-30;2021-09-30;2021-10-05;2021-10-05;2021-09-30
19935;CPU215;Encarnacion Ezcurra;NB_IOT;MATIAS EZEQUIEL;COSENTINO;M. COSENTINO;CEEZ;AMBA;;ISM-10345;OA;18/11/2020 13:43;18/11/2020 13:43;17/2/2021 23:53;4/3/2021 16:05;5/3/2021 18:44;;-346.163;-583.625;CPU;MOP;Huawei;OA;OA Completado;2021-03-08;;2021-02-12;2021-02-12;2021-02-12;2021-03-08;2021-02-12
19936;CPU285;Edificio Guardacostas;NB_IOT;JUAN PABLO;PIANELLO;J. PIANELLO;CEGC;AMBA;;ISM-11805;OA;26/11/2020 12:20;26/11/2020 12:20;26/10/2021 17:37;28/10/2021 19:48;29/10/2021 10:36;;-346.043;-583.678;CPU;MOP;Huawei;OA;OA Completado;2021-10-05;;2021-09-30;2021-09-30;2021-10-05;2021-10-05;2021-09-30
19937;CPU311;Edificio Illia;NB_IOT;Sin Asignar;Sin Asignar;Sin Asignar;CEILTP;AMBA;;ISM-10346;OA;18/11/2020 14:59;18/11/2020 14:59;27/1/2021 12:54;27/1/2021 14:55;28/1/2021 11:51;;-345.789;-583.861;CPU;MOP;Huawei;OA;OA Completado;2021-01-27;;2021-01-26;2021-01-27;2021-01-27;2021-01-27;2021-01-27
19938;CPU212;Edificio Libertad 2;NB_IOT;JUAN PABLO;PIANELLO;J. PIANELLO;CELI;AMBA;;ISM-10347;OA;18/11/2020 13:41;18/11/2020 13:41;26/10/2021 17:37;28/10/2021 19:14;29/10/2021 10:38;;-34.588;-583.674;CPU;MOP;Huawei;OA;OA Completado;2021-10-05;;2021-09-30;2021-09-30;2021-10-05;2021-10-05;2021-09-30
19939;CPU375;Estadio Malvinas Argentinas;NB_IOT;JUAN PABLO;PIANELLO;J. PIANELLO;CEMA;AMBA;;ISM-10348;OA;18/11/2020 15:31;18/11/2020 15:31;26/10/2021 17:39;28/10/2021 20:55;29/10/2021 10:29;;-345.917;-584.723;CPU;MOP;Huawei;OA;OA Completado;2021-10-05;;2021-09-30;2021-09-30;2021-10-05;2021-10-05;2021-09-30
19940;CPU520;Encina;NB_IOT;JUAN PABLO;PIANELLO;J. PIANELLO;CENCIN;AMBA;;ISM-10349;OA;19/11/2020 11:01;19/11/2020 11:01;26/10/2021 17:37;28/10/2021 19:14;29/10/2021 10:38;;;;;MOP;Huawei;OA;OA Completado;2021-10-05;;2021-10-01;2021-10-01;2021-10-05;2021-10-05;2021-09-30
19941;CPU805;Escuela Nacional de Nautica;NB_IOT;MATIAS EZEQUIEL;COSENTINO;M. COSENTINO;CENNAU;AMBA;;ISM-10350;OA;19/11/2020 14:57;19/11/2020 14:57;17/2/2021 23:53;4/3/2021 16:03;5/3/2021 18:45;;-345.922;-583.697;CPU;MOP;Huawei;OA;OA Completado;2021-03-08;;2021-02-18;2021-02-18;2021-02-18;2021-03-08;2021-02-18
19943;CPU211;Palermo;NB_IOT;JUAN PABLO;PIANELLO;J. PIANELLO;CERM;AMBA;;ISM-10352;OA;18/11/2020 13:41;18/11/2020 13:41;26/10/2021 17:39;28/10/2021 21:22;29/10/2021 10:25;;-345.797;-584.205;CPU;MOP;Huawei;OA;OA Completado;2021-10-05;;2021-09-30;2021-09-30;2021-10-05;2021-10-05;2021-09-30
19944;CPU233;Estacion Saavedra;NB_IOT;JUAN PABLO;PIANELLO;J. PIANELLO;CESA;AMBA;;ISM-10353;OA;18/11/2020 13:54;18/11/2020 13:54;26/10/2021 17:39;28/10/2021 20:44;29/10/2021 10:30;;-345.538;-584.882;CPU;MOP;Huawei;OA;OA Completado;2021-10-05;;2021-09-30;2021-09-30;2021-10-05;2021-10-05;2021-09-30
19945;CPU074;Estomba;NB_IOT;JUAN PABLO;PIANELLO;J. PIANELLO;CESB;AMBA;;ISM-10354;OA;17/11/2020 14:05;17/11/2020 14:05;26/10/2021 17:37;28/10/2021 19:57;29/10/2021 10:34;;-345.776;-584.654;CPU;MOP;Huawei;OA;OA Completado;2021-10-05;;2021-09-29;2021-09-29;2021-10-05;2021-10-05;2021-09-30
19946;CPU312;Estadio San Lorenzo;NB_IOT;JUAN PABLO;PIANELLO;J. PIANELLO;CESL;AMBA;;ISM-10355;OA;18/11/2020 14:59;18/11/2020 14:59;26/10/2021 17:37;28/10/2021 19:41;29/10/2021 10:36;;-346.513;-584.402;CPU;MOP;Huawei;OA;OA Completado;2021-10-05;;2021-09-30;2021-09-30;2021-10-05;2021-10-05;2021-10-30
19947;CPU380;Esmeralda;NB_IOT;MATIAS EZEQUIEL;COSENTINO;M. COSENTINO;CESM;AMBA;;ISM-10356;OA;18/11/2020 15:45;18/11/2020 15:45;17/2/2021 23:53;4/3/2021 16:12;5/3/2021 18:42;;-345.957;-583.788;CPU;MOP;Huawei;OA;OA Completado;2021-03-08;;2021-02-10;2021-02-10;2021-02-12;2021-03-08;2021-02-12
19948;CPU193;Estados Unidos;NB_IOT;JUAN PABLO;PIANELLO;J. PIANELLO;CEUA;AMBA;;ISM-10357;OA;18/11/2020 12:54;18/11/2020 12:54;26/10/2021 17:37;28/10/2021 20:44;29/10/2021 10:30;;-346.189;-58.38;CPU;MOP;Huawei;OA;OA Completado;2021-10-05;;2021-09-30;2021-09-30;2021-10-05;2021-10-05;2021-09-30
19950;CPU252;Exedra 2;NB_IOT;JUAN PABLO;PIANELLO;J. PIANELLO;CEX2;AMBA;;ISM-10359;OA;18/11/2020 14:19;18/11/2020 14:19;26/10/2021 17:37;28/10/2021 20:06;29/10/2021 10:32;;-345.986;-583.803;CPU;MOP;Huawei;OA;OA Completado;2021-10-05;;2021-09-30;2021-09-30;2021-10-05;2021-10-05;2021-09-30
19951;CPU041;Favaloro;NB_IOT;JUAN PABLO;PIANELLO;J. PIANELLO;CFAV;AMBA;;ISM-10360;OA;17/11/2020 13:48;17/11/2020 13:48;26/10/2021 17:37;28/10/2021 20:01;29/10/2021 10:34;;-346.134;-583.901;CPU;MOP;Huawei;OA;OA Completado;2021-10-05;;2021-09-29;2021-09-29;2021-10-05;2021-10-05;2021-09-30
19952;CPU508;Fernandez de la Cruz;NB_IOT;MATIAS EZEQUIEL;COSENTINO;M. COSENTINO;CFCRUZ;AMBA;;ISM-10361;OA;19/11/2020 10:59;19/11/2020 10:59;17/2/2021 23:53;4/3/2021 16:18;5/3/2021 18:42;;;;;MOP;Huawei;OA;OA Completado;2021-03-08;;2021-02-18;2021-02-18;2021-02-18;2021-03-08;2021-02-18
19953;CPU378;Fierro Hotel Boutique;NB_IOT;MATIAS EZEQUIEL;COSENTINO;M. COSENTINO;CFHB;AMBA;;ISM-10362;OA;18/11/2020 15:45;18/11/2020 15:45;17/2/2021 23:53;4/3/2021 16:12;5/3/2021 18:42;;-345.789;-584.354;CPU;MOP;Huawei;OA;OA Completado;2021-03-08;;2021-02-10;2021-02-10;2021-02-12;2021-03-08;2021-02-12
19954;CPU013;Florida;NB_IOT;MATIAS EZEQUIEL;COSENTINO;M. COSENTINO;CFLO;AMBA;;ISM-10363;OA;17/11/2020 12:49;17/11/2020 12:49;17/2/2021 23:53;4/3/2021 16:07;5/3/2021 18:44;;-346.078;-583.746;CPU;MOP;Huawei;OA;OA Completado;2021-03-08;;2021-02-11;2021-02-11;2021-02-11;2021-03-08;2021-02-11
19955;CPU152;Flores;NB_IOT;JUAN PABLO;PIANELLO;J. PIANELLO;CFLR;AMBA;;ISM-10364;OA;18/11/2020 10:05;18/11/2020 10:05;26/10/2021 17:39;28/10/2021 21:00;29/10/2021 10:27;;-346.351;-584.625;CPU;MOP;Huawei;OA;OA Completado;2021-10-05;;2021-09-30;2021-09-30;2021-10-05;2021-10-05;2021-09-30
19956;CPU202;Four Seasons;NB_IOT;MATIAS EZEQUIEL;COSENTINO;M. COSENTINO;CFOS;AMBA;;ISM-10365;OA;18/11/2020 13:39;18/11/2020 13:39;17/2/2021 23:51;4/3/2021 15:27;5/3/2021 18:49;;-345.906;-583.826;CPU;MOP;Huawei;OA;OA Completado;2021-03-08;;2021-02-17;2021-02-17;2021-02-17;2021-03-08;2021-02-17
19958;CPU127;Gaona;NB_IOT;JUAN PABLO;PIANELLO;J. PIANELLO;CGAO;AMBA;;ISM-10367;RFI;18/11/2020 09:54;18/11/2020 09:54;;;;;-346.163;-584.649;CPU;MOP;Huawei;OA;OA Completado;2021-10-05;;2021-09-30;2021-09-30;2021-10-05;2021-10-05;2021-09-30
19959;CPU006;Galerias Pacifico;NB_IOT;MATIAS EZEQUIEL;COSENTINO;M. COSENTINO;CGAP;AMBA;;ISM-10368;OA;17/11/2020 12:42;17/11/2020 12:42;17/2/2021 23:53;4/3/2021 16:16;5/3/2021 18:42;;-345.983;-583.741;CPU;MOP;Huawei;OA;OA Completado;2021-03-08;;2021-02-17;2021-02-17;2021-02-17;2021-03-08;2021-02-17
19960;CPU330;Galerias Hotel;NB_IOT;JUAN PABLO;PIANELLO;J. PIANELLO;CGHT;AMBA;;ISM-10369;OA;18/11/2020 15:22;18/11/2020 15:22;26/10/2021 17:37;28/10/2021 19:54;29/10/2021 10:34;;-346.009;-583.761;CPU;MOP;Huawei;OA;OA Completado;2021-10-05;;2021-09-30;2021-09-30;2021-10-05;2021-10-05;2021-09-30
19961;CPU077;Golf;NB_IOT;Sin Asignar;Sin Asignar;Sin Asignar;CGLF;AMBA;;ISM-10370;OA;17/11/2020 14:06;17/11/2020 14:06;27/1/2021 16:50;27/1/2021 17:53;28/1/2021 12:42;;-345.751;-584.359;CPU;MOP;Huawei;OA;OA Completado;2021-01-28;;2021-01-27;2021-01-27;2021-01-28;2021-01-28;2021-01-28
19962;CPU085;Gabriela Mistral;NB_IOT;JUAN PABLO;PIANELLO;J. PIANELLO;CGMI;AMBA;;ISM-10371;OA;17/11/2020 14:08;17/11/2020 14:08;26/10/2021 17:39;28/10/2021 20:48;29/10/2021 10:30;;-345.892;-585.045;CPU;MOP;Huawei;OA;OA Completado;2021-10-05;;2021-09-29;2021-09-29;2021-10-05;2021-10-05;2021-09-30
19963;CPU374;Geba Newbery;NB_IOT;JUAN PABLO;PIANELLO;J. PIANELLO;CGNW;AMBA;;ISM-10372;OA;18/11/2020 15:29;18/11/2020 15:29;26/10/2021 17:37;28/10/2021 19:52;29/10/2021 10:34;;-345.682;-584.197;CPU;MOP;Huawei;OA;OA Completado;2021-10-05;;2021-09-30;2021-09-30;2021-10-05;2021-10-05;2021-09-30
19966;CPU373;Geba San Martin;NB_IOT;JUAN PABLO;PIANELLO;J. PIANELLO;CGSM;AMBA;;ISM-10375;OA;18/11/2020 15:29;18/11/2020 15:29;26/10/2021 17:37;28/10/2021 19:39;29/10/2021 10:36;;-345.603;-584.216;CPU;MOP;Huawei;OA;OA Completado;2021-10-05;;2021-09-30;2021-09-30;2021-10-05;2021-10-05;2021-09-30
19967;CPU445;Gurruchaga;NB_IOT;JUAN PABLO;PIANELLO;J. PIANELLO;CGUR;AMBA;;ISM-10376;OA;19/11/2020 10:20;19/11/2020 10:20;26/10/2021 17:39;28/10/2021 21:20;29/10/2021 10:25;;-345.845;-584.218;CPU;MOP;Huawei;OA;OA Completado;2021-10-05;;2021-09-30;2021-09-30;2021-10-05;2021-10-05;2021-09-30
19968;CPU133;Guayaquil;NB_IOT;Sin Asignar;Sin Asignar;Sin Asignar;CGUYTP;AMBA;;ISM-10377;OA;18/11/2020 09:56;18/11/2020 09:56;22/1/2021 12:36;25/1/2021 15:08;25/1/2021 15:13;;-346.194;-584.294;CPU;MOP;Huawei;OA;OA Completado;2021-01-25;;2021-01-20;2021-01-22;2021-01-22;2021-01-25;2021-01-22
19969;CPU120;Hospital Aleman;NB_IOT;Sin Asignar;Sin Asignar;Sin Asignar;CHAL;AMBA;;ISM-10378;OA;18/11/2020 09:51;18/11/2020 09:51;21/1/2021 14:06;21/1/2021 14:28;25/1/2021 11:28;;-345.927;-584.001;CPU;MOP;Huawei;OA;OA Completado;2021-01-25;;2021-01-21;2021-01-21;2021-01-21;2021-01-25;2021-01-21
19970;CPU254;Hospital Britanico Cpu254;NB_IOT;Sin Asignar;Sin Asignar;Sin Asignar;CHBR;AMBA;;ISM-10379;OA;18/11/2020 14:17;18/11/2020 14:17;13/1/2021 18:15;14/1/2021 09:02;15/1/2021 14:55;;-346.335;-58.389;CPU;MOP;Huawei;OA;OA Completado;2021-01-15;;2021-01-13;2021-01-13;2021-01-13;2021-01-15;2021-01-13
19971;CPU078;Hotel Colombo;NB_IOT;Sin Asignar;Sin Asignar;Sin Asignar;CHCOTP;AMBA;;ISM-10380;OA;17/11/2020 14:06;17/11/2020 14:06;22/1/2021 09:31;22/1/2021 10:59;25/1/2021 12:29;;-345.768;-584.217;CPU;MOP;Huawei;OA;OA Completado;2021-01-25;;2021-01-20;2021-01-22;2021-01-22;2021-01-25;2021-01-22
19972;CPU136;Hospital Español;NB_IOT;JUAN PABLO;PIANELLO;J. PIANELLO;CHES;AMBA;;ISM-10381;OA;18/11/2020 09:58;18/11/2020 09:58;26/10/2021 17:37;28/10/2021 19:14;29/10/2021 10:38;;-346.166;-584.079;CPU;MOP;Huawei;OA;OA Completado;2021-10-05;;2021-09-30;2021-09-30;2021-10-05;2021-10-05;2021-09-30
19973;CPU441;Chiclana;NB_IOT;JUAN PABLO;PIANELLO;J. PIANELLO;CHICLA;AMBA;;ISM-10382;OA;19/11/2020 10:18;19/11/2020 10:18;26/10/2021 17:39;28/10/2021 20:48;29/10/2021 10:30;;;;;MOP;Huawei;OA;OA Completado;2021-10-05;;2021-09-30;2021-09-30;2021-10-05;2021-10-05;2021-09-30
19974;CPU040;Hilton;NB_IOT;Sin Asignar;Sin Asignar;Sin Asignar;CHIL;AMBA;;ISM-10383;OA;17/11/2020 13:47;17/11/2020 13:47;5/2/2021 13:57;5/2/2021 15:36;14/2/2021 19:54;;-346.059;-583.638;CPU;MOP;Huawei;OA;OA Completado;2021-02-05;;2021-02-05;2021-02-05;2021-02-05;2021-02-05;2021-02-05
19975;CPU287;Hipodromo De Palermo;NB_IOT;MATIAS EZEQUIEL;COSENTINO;M. COSENTINO;CHIP;AMBA;;ISM-10384;OA;18/11/2020 14:51;18/11/2020 14:51;17/2/2021 23:53;3/3/2021 14:51;5/3/2021 18:51;;-345.692;-584.251;CPU;MOP;Huawei;OA;OA Completado;2021-03-08;;2021-02-18;2021-02-18;2021-02-18;2021-03-08;2021-02-18
19976;CPU118;Hospital Italiano;NB_IOT;JUAN PABLO;PIANELLO;J. PIANELLO;CHIT;AMBA;;ISM-10385;OA;18/11/2020 09:51;18/11/2020 09:51;26/10/2021 17:39;28/10/2021 20:44;29/10/2021 10:30;;-346.088;-58.426;CPU;MOP;Huawei;OA;OA Completado;2021-10-05;;2021-09-30;2021-09-30;2021-10-05;2021-10-05;2021-09-30
19977;CPU369;Hospital Penna;NB_IOT;JUAN PABLO;PIANELLO;J. PIANELLO;CHPE;AMBA;;ISM-10386;OA;18/11/2020 15:27;18/11/2020 15:27;26/10/2021 17:39;28/10/2021 20:46;29/10/2021 10:30;;-346.408;-584.111;CPU;MOP;Huawei;OA;OA Completado;2021-10-05;;2021-09-30;2021-09-30;2021-10-05;2021-10-05;2021-09-30
19978;CPU486;Honorio Pueyrredon;NB_IOT;MATIAS EZEQUIEL;COSENTINO;M. COSENTINO;CHPY;AMBA;;ISM-10387;OA;19/11/2020 10:54;19/11/2020 10:54;17/2/2021 23:53;4/3/2021 16:16;5/3/2021 18:42;;-346.105;-584.429;CPU;MOP;Huawei;OA;OA Completado;2021-03-08;;2021-02-11;2021-02-11;2021-02-11;2021-03-08;2021-02-11
19979;CPU060;Harrods;NB_IOT;JUAN PABLO;PIANELLO;J. PIANELLO;CHRR;AMBA;;ISM-10388;OA;17/11/2020 14:01;17/11/2020 14:01;26/10/2021 17:39;28/10/2021 20:51;29/10/2021 10:30;;-345.621;-584.402;CPU;MOP;Huawei;OA;OA Completado;2021-10-05;;2021-09-29;2021-09-29;2021-09-30;2021-10-05;2021-09-30
19980;CPU301;Hacoaj Sede Capital Cpu301;NB_IOT;MATIAS EZEQUIEL;COSENTINO;M. COSENTINO;CHSC;AMBA;;ISM-10389;OA;18/11/2020 14:55;18/11/2020 14:55;17/2/2021 23:51;4/3/2021 13:41;5/3/2021 18:49;;-34.598;-584.242;CPU;MOP;Huawei;OA;OA Completado;2021-03-08;;2021-02-12;2021-02-12;2021-02-12;2021-03-08;2021-02-12
19981;CPU024;Hospital;NB_IOT;MATIAS EZEQUIEL;COSENTINO;M. COSENTINO;CHSP;AMBA;;ISM-10390;OA;17/11/2020 13:00;17/11/2020 13:00;17/2/2021 23:51;4/3/2021 15:45;5/3/2021 18:47;;-345.997;-584.015;CPU;MOP;Huawei;OA;OA Completado;2021-03-08;;2021-02-11;2021-02-11;2021-02-11;2021-03-08;2021-02-11
19982;CPU181;Humboldt;NB_IOT;JUAN PABLO;PIANELLO;J. PIANELLO;CHUM;AMBA;;ISM-10391;RFI;18/11/2020 12:51;18/11/2020 12:51;;;;;-345.782;-584.273;CPU;MOP;Huawei;OA;OA Completado;2021-10-05;;2021-09-30;2021-09-30;2021-10-05;2021-10-05;2021-09-30
19983;CPU168;Huracan;NB_IOT;Sin Asignar;Sin Asignar;Sin Asignar;CHUNTP;AMBA;;ISM-10392;OA;18/11/2020 10:12;18/11/2020 10:12;22/1/2021 12:11;22/1/2021 12:38;25/1/2021 12:31;;-346.489;-58.399;CPU;MOP;Huawei;OA;OA Completado;2021-01-25;;2021-01-20;2021-01-22;2021-01-22;2021-01-25;2021-01-22
19984;CPU295;Hospital Velez Sarsfield 2;NB_IOT;MATIAS EZEQUIEL;COSENTINO;M. COSENTINO;CHV2;AMBA;;ISM-10393;OA;18/11/2020 14:53;18/11/2020 14:53;17/2/2021 23:53;4/3/2021 15:58;5/3/2021 18:45;;-34.625;-585.073;CPU;MOP;Huawei;OA;OA Completado;2021-03-08;;2021-02-12;2021-02-12;2021-02-12;2021-03-08;2021-02-12
19985;CPU032;Iglesia La Piedad;NB_IOT;JUAN PABLO;PIANELLO;J. PIANELLO;CIGL;AMBA;;ISM-10394;OA;17/11/2020 13:43;17/11/2020 13:43;26/10/2021 17:37;28/10/2021 19:59;29/10/2021 10:34;;-346.071;-583.876;CPU;MOP;Huawei;OA;OA Completado;2021-10-05;;2021-09-29;2021-09-29;2021-09-30;2021-10-05;2021-09-30
19986;CPU201;Facultad De Ingenieria;NB_IOT;Sin Asignar;Sin Asignar;Sin Asignar;CING;AMBA;;ISM-10395;OA;18/11/2020 13:25;18/11/2020 13:25;13/1/2021 17:19;14/1/2021 08:51;15/1/2021 14:50;;-34.589;-583.966;CPU;MOP;Huawei;OA;OA Completado;2021-01-17;;2021-01-13;2021-01-13;2021-01-13;2021-01-17;2021-01-13
19987;CPU004;Marriot;NB_IOT;Sin Asignar;Sin Asignar;Sin Asignar;CIOT;AMBA;;ISM-10396;OA;17/11/2020 12:40;17/11/2020 12:40;26/10/2021 17:37;28/10/2021 19:50;29/10/2021 10:34;;-34.596;-583.749;CPU;MOP;Huawei;OA;OA Completado;2021-09-28;;2021-09-28;2021-09-28;2021-09-28;2021-09-28;2021-09-30
19988;CPU069;Hipico;NB_IOT;JUAN PABLO;PIANELLO;J. PIANELLO;CIPI;AMBA;;ISM-10397;OA;17/11/2020 14:03;17/11/2020 14:03;26/10/2021 17:37;28/10/2021 20:35;29/10/2021 10:30;;-345.652;-584.172;CPU;MOP;Huawei;OA;OA Completado;2021-10-05;;2021-09-29;2021-09-29;2021-09-30;2021-10-05;2021-09-30
19989;CPU105;Juan B. Justo;NB_IOT;Sin Asignar;Sin Asignar;Sin Asignar;CJBJ;AMBA;;ISM-10398;OA;18/11/2020 09:24;18/11/2020 09:24;25/1/2021 12:06;25/1/2021 14:57;25/1/2021 15:02;;-34.604;-584.627;CPU;MOP;Huawei;OA;OA Completado;2021-01-25;;2021-01-25;2021-01-25;2021-01-25;2021-01-25;2021-01-25
19990;CPU113;Jonte;NB_IOT;Sin Asignar;Sin Asignar;Sin Asignar;CJNTTP;AMBA;;ISM-10399;OA;18/11/2020 09:40;18/11/2020 09:40;22/1/2021 12:13;22/1/2021 12:38;25/1/2021 12:33;;-346.126;-584.906;CPU;MOP;Huawei;OA;OA Completado;2021-01-25;;2021-01-20;2021-01-22;2021-01-22;2021-01-25;2021-01-22
19992;CPU022;Juncal 2;NB_IOT;JUAN PABLO;PIANELLO;J. PIANELLO;CJU2;AMBA;;ISM-10401;RFI;17/11/2020 12:58;17/11/2020 12:58;;;;;-345.948;-58.391;CPU;MOP;Huawei;OA;OA Completado;2021-10-05;;2021-09-29;2021-09-29;2021-09-30;2021-10-05;2021-09-30
19993;CPU021;Junin;NB_IOT;MATIAS EZEQUIEL;COSENTINO;M. COSENTINO;CJUI;AMBA;;ISM-10402;OA;18/11/2020 14:08;18/11/2020 14:08;17/2/2021 23:51;4/3/2021 15:24;5/3/2021 18:49;;-345.939;-583.973;CPU;MOP;Huawei;OA;OA Completado;2021-03-08;;2021-02-11;2021-02-11;2021-02-11;2021-03-08;2021-02-11
19994;CPU058;Juramento;NB_IOT;JUAN PABLO;PIANELLO;J. PIANELLO;CJUR;AMBA;;ISM-10403;OA;26/11/2020 12:15;26/11/2020 12:15;26/10/2021 17:39;28/10/2021 21:22;29/10/2021 10:25;;-345.597;-584.522;CPU;MOP;Huawei;OA;OA Completado;2021-10-05;;2021-09-29;2021-09-29;2021-09-30;2021-10-05;2021-09-30
19995;CPU143;Jujuy;NB_IOT;JUAN PABLO;PIANELLO;J. PIANELLO;CJUY;AMBA;;ISM-10404;RFI;18/11/2020 10:03;18/11/2020 10:03;;;;;-346.249;-584.015;CPU;MOP;Huawei;OA;OA Completado;2021-10-05;;2021-09-30;2021-09-30;2021-10-05;2021-10-05;2021-09-30
19996;CPU019;Las Heras;NB_IOT;JUAN PABLO;PIANELLO;J. PIANELLO;CLAH;AMBA;;ISM-10405;OA;18/11/2020 14:06;18/11/2020 14:06;26/10/2021 17:39;28/10/2021 20:48;29/10/2021 10:30;;-345.906;-583.938;CPU;MOP;Huawei;OA;OA Completado;2021-10-05;;2021-09-29;2021-09-29;2021-09-30;2021-10-05;2021-09-30
19997;CPU108;Lambare;NB_IOT;Sin Asignar;Sin Asignar;Sin Asignar;CLAM;AMBA;;ISM-10406;OA;18/11/2020 09:27;18/11/2020 09:27;15/7/2021 11:23;15/7/2021 16:52;15/7/2021 17:19;;-346.004;-58.43;CPU;MOP;Huawei;OA;OA Completado;2021-07-15;;2021-07-15;2021-07-15;2021-07-15;2021-07-15;2021-07-15
19998;CPU018;Laprida;NB_IOT;MATIAS EZEQUIEL;COSENTINO;M. COSENTINO;CLAP;AMBA;;ISM-10407;OA;17/11/2020 12:54;17/11/2020 12:54;17/2/2021 23:51;4/3/2021 15:45;5/3/2021 18:47;;-345.878;-584.004;CPU;MOP;Huawei;OA;OA Completado;2021-03-08;;2021-02-11;2021-02-11;2021-02-11;2021-03-08;2021-02-11
19999;CPU030;Larrea;NB_IOT;JUAN PABLO;PIANELLO;J. PIANELLO;CLAR;AMBA;;ISM-10408;OA;17/11/2020 13:32;17/11/2020 13:32;26/10/2021 17:39;28/10/2021 21:09;29/10/2021 10:27;;-346.083;-584.027;CPU;MOP;Huawei;OA;OA Completado;2021-10-05;;2021-09-29;2021-09-29;2021-09-30;2021-10-05;2021-09-30
20000;CPU302;Lavalle;NB_IOT;Sin Asignar;Sin Asignar;Sin Asignar;CLAV;AMBA;;ISM-10409;OA;18/11/2020 14:55;18/11/2020 14:55;11/1/2021 16:38;12/1/2021 09:42;12/1/2021 16:30;;-346.022;-583.731;CPU;MOP;Huawei;OA;OA Completado;2021-01-12;;2021-01-05;2021-01-11;2021-01-11;2021-01-12;2021-01-11
20001;CPU314;Parque Lezama 2;NB_IOT;JUAN PABLO;PIANELLO;J. PIANELLO;CLE2;AMBA;;ISM-10410;OA;18/11/2020 15:00;18/11/2020 15:00;26/10/2021 17:37;28/10/2021 19:23;29/10/2021 10:38;;-346.255;-583.667;CPU;MOP;Huawei;OA;OA Completado;2021-10-05;;2021-09-30;2021-09-30;2021-10-05;2021-10-05;2021-10-30
20002;CPU147;Liniers;NB_IOT;Sin Asignar;Sin Asignar;Sin Asignar;CLIN;AMBA;;ISM-10411;OA;18/11/2020 15:04;18/11/2020 15:04;21/1/2021 13:00;22/1/2021 12:27;25/1/2021 13:30;;-346.405;-585.203;CPU;MOP;Huawei;OA;OA Completado;2021-01-25;;2021-01-21;2021-01-21;2021-01-22;2021-01-25;2021-01-22
20003;CPU195;Miller;NB_IOT;Sin Asignar;Sin Asignar;Sin Asignar;CLLE;AMBA;;ISM-10412;OA;26/11/2020 12:15;26/11/2020 12:15;21/1/2021 18:08;22/1/2021 10:52;1/2/2021 19:03;;-345.727;-58.479;CPU;MOP;Huawei;OA;OA Completado;2021-02-01;;2021-01-21;2021-01-21;2021-01-21;2021-02-01;2021-01-21
20004;CPU410;La Rioja;NB_IOT;JUAN PABLO;PIANELLO;J. PIANELLO;CLRJ;AMBA;;ISM-10413;OA;18/11/2020 15:51;18/11/2020 15:51;26/10/2021 17:37;28/10/2021 19:23;29/10/2021 10:38;;-34.623;-584.075;CPU;MOP;Huawei;OA;OA Completado;2021-10-05;;2021-09-30;2021-09-30;2021-10-05;2021-10-05;2021-09-30
20005;CPU823;Lugones;NB_IOT;JUAN PABLO;PIANELLO;J. PIANELLO;CLUGON;AMBA;;ISM-10414;OA;19/11/2020 15:00;19/11/2020 15:00;26/10/2021 17:37;28/10/2021 19:57;29/10/2021 10:34;;;;;MOP;Huawei;OA;OA Completado;2021-10-05;;2021-10-01;2021-10-01;2021-10-05;2021-10-05;2021-09-30
20006;CPU178;Lugano;NB_IOT;JUAN PABLO;PIANELLO;J. PIANELLO;CLUG;AMBA;;ISM-10415;OA;18/11/2020 10:14;18/11/2020 10:14;26/10/2021 17:39;28/10/2021 20:46;29/10/2021 10:30;;-346.782;-584.776;CPU;MOP;Huawei;OA;OA Completado;2021-10-05;;2021-09-30;2021-09-30;2021-10-05;2021-10-05;2021-09-30
20007;CPU255;Lavalleja;NB_IOT;Sin Asignar;Sin Asignar;Sin Asignar;CLVJ;AMBA;;ISM-10416;OA;18/11/2020 14:17;18/11/2020 14:17;27/1/2021 16:25;27/1/2021 17:32;28/1/2021 11:46;;-345.961;-584.275;CPU;MOP;Huawei;OA;OA Completado;2021-01-27;;2021-01-27;2021-01-27;2021-01-27;2021-01-27;2021-01-27
20008;CPU247;Mapfre;NB_IOT;Sin Asignar;Sin Asignar;Sin Asignar;CMAF;AMBA;;ISM-10417;OA;18/11/2020 13:59;18/11/2020 13:59;10/2/2021 15:45;10/2/2021 16:41;10/2/2021 16:57;;-346.001;-583.644;CPU;MOP;Huawei;OA;OA Completado;2021-02-10;;2021-02-05;2021-02-05;2021-02-10;2021-02-10;2021-02-10
20009;CPU665;Museo De Arte Moderno;NB_IOT;JUAN PABLO;PIANELLO;J. PIANELLO;CMAM;AMBA;;ISM-10418;OA;19/11/2020 12:13;19/11/2020 12:13;26/10/2021 17:37;28/10/2021 20:19;29/10/2021 10:32;;-34.622;-583.707;CPU;MOP;Huawei;OA;OA Completado;2021-10-05;;2021-10-01;2021-10-01;2021-10-05;2021-10-05;2021-09-30
20010;CPU142;Maza;NB_IOT;SEBASTIAN;ANGELERI;S. ANGELERI;CMAZ;AMBA;;ISM-10419;OA;18/11/2020 10:02;18/11/2020 10:02;26/10/2021 17:37;28/10/2021 19:36;29/10/2021 10:36;;-346.256;-584.144;CPU;MOP;Huawei;OA;OA Completado;2021-10-06;;2021-09-30;2021-09-30;2021-10-05;2021-10-06;2021-09-30
20011;CPU100;Mario Bravo;NB_IOT;MATIAS EZEQUIEL;COSENTINO;M. COSENTINO;CMBO;AMBA;;ISM-10420;OA;18/11/2020 09:04;18/11/2020 09:04;17/2/2021 23:53;4/3/2021 16:14;5/3/2021 18:42;;-345.977;-584.156;CPU;MOP;Huawei;OA;OA Completado;2021-03-08;;2021-02-09;2021-02-09;2021-02-09;2021-03-08;2021-02-09
20012;CPU542;Monte Castro Sur;NB_IOT;JUAN PABLO;PIANELLO;J. PIANELLO;CMCS;AMBA;;ISM-10421;OA;19/11/2020 11:06;19/11/2020 11:06;26/10/2021 17:37;28/10/2021 19:29;29/10/2021 10:36;;-34.622;-585.018;CPU;MOP;Huawei;OA;OA Completado;2021-10-05;;2021-10-01;2021-10-01;2021-10-05;2021-10-05;2021-09-30
20013;CPU273;Ministerio De Economia;NB_IOT;MATIAS EZEQUIEL;COSENTINO;M. COSENTINO;CMDE;AMBA;;ISM-10422;OA;18/11/2020 14:46;18/11/2020 14:46;17/2/2021 23:53;4/3/2021 15:51;5/3/2021 18:45;;-346.095;-583.701;CPU;MOP;Huawei;OA;OA Completado;2021-03-08;;2021-02-11;2021-02-11;2021-02-11;2021-03-08;2021-02-11
20014;CPU221;Mercado De Liniers;NB_IOT;JUAN PABLO;PIANELLO;J. PIANELLO;CMDL;AMBA;;ISM-10423;OA;26/11/2020 12:18;26/11/2020 12:18;26/10/2021 17:39;28/10/2021 21:22;29/10/2021 10:25;;-346.641;-585.008;CPU;MOP;Huawei;OA;OA Completado;2021-10-05;;2021-09-30;2021-09-30;2021-10-05;2021-10-05;2021-09-30
20015;CPU606;Mendoza;NB_IOT;MATIAS EZEQUIEL;COSENTINO;M. COSENTINO;CMDZ;AMBA;;ISM-10424;OA;19/11/2020 12:04;19/11/2020 12:04;17/2/2021 23:51;4/3/2021 15:20;5/3/2021 18:49;;-345.625;-584.602;CPU;MOP;Huawei;OA;OA Completado;2021-03-08;;2021-02-11;2021-02-11;2021-02-11;2021-03-08;2021-02-11
20016;CPU109;Medrano;NB_IOT;JUAN PABLO;PIANELLO;J. PIANELLO;CMED;AMBA;;ISM-10425;OA;18/11/2020 09:36;18/11/2020 09:36;26/10/2021 17:37;28/10/2021 19:34;29/10/2021 10:36;;-346.044;-584.213;CPU;MOP;Huawei;OA;OA Completado;2021-10-05;;2021-09-30;2021-09-30;2021-10-05;2021-10-05;2021-09-30
20017;CPU119;Mitre;NB_IOT;MATIAS EZEQUIEL;COSENTINO;M. COSENTINO;CMIT;AMBA;;ISM-10427;OA;18/11/2020 09:51;18/11/2020 09:51;17/2/2021 23:53;4/3/2021 16:05;5/3/2021 18:44;;-346.094;-584.133;CPU;MOP;Huawei;OA;OA Completado;2021-03-08;;2021-02-18;2021-02-18;2021-02-18;2021-03-08;2021-02-18
20018;CPU662;Ministerio De Justicia Y Seguridad Gcba;NB_IOT;JUAN PABLO;PIANELLO;J. PIANELLO;CMJS;AMBA;;ISM-10428;OA;19/11/2020 12:11;19/11/2020 12:11;26/10/2021 17:39;28/10/2021 21:15;29/10/2021 10:25;;-346.403;-583.688;CPU;MOP;Huawei;OA;OA Completado;2021-10-05;;2021-10-01;2021-10-01;2021-10-05;2021-10-05;2021-09-30
20019;CPU558;Melincue;NB_IOT;JUAN PABLO;PIANELLO;J. PIANELLO;CMLC;AMBA;;ISM-10429;OA;19/11/2020 11:08;19/11/2020 11:08;26/10/2021 17:39;28/10/2021 20:50;29/10/2021 10:30;;-346.077;-585.026;CPU;MOP;Huawei;OA;OA Completado;2021-10-05;;2021-10-01;2021-10-01;2021-10-05;2021-10-05;2021-09-30
20021;CPU196;AUSA Medalla Milagrosa;NB_IOT;JUAN PABLO;PIANELLO;J. PIANELLO;CMMI;AMBA;;ISM-10431;OA;18/11/2020 12:54;18/11/2020 12:54;26/10/2021 17:37;28/10/2021 19:27;29/10/2021 10:36;;-34.637;-584.458;CPU;MOP;Huawei;OA;OA Completado;2021-10-05;;2021-09-30;2021-09-30;2021-10-05;2021-10-05;2021-09-30
20022;CPU049;Montañeses;NB_IOT;JUAN PABLO;PIANELLO;J. PIANELLO;CMNS;AMBA;;ISM-10432;OA;17/11/2020 13:56;17/11/2020 13:56;26/10/2021 17:37;28/10/2021 20:30;29/10/2021 10:32;;-345.533;-584.521;CPU;MOP;Huawei;OA;OA Completado;2021-10-05;;2021-09-29;2021-09-29;2021-09-30;2021-10-05;2021-09-30
20023;CPU457;Montesquieu;NB_IOT;JUAN PABLO;PIANELLO;J. PIANELLO;CMNTSQ;AMBA;;ISM-10433;OA;19/11/2020 10:21;19/11/2020 10:21;26/10/2021 17:39;28/10/2021 20:53;29/10/2021 10:29;;;;;MOP;Huawei;OA;OA Completado;2021-10-05;;2021-09-30;2021-09-30;2021-10-05;2021-10-05;2021-09-30
20024;CPU037;Monserrat;NB_IOT;Sin Asignar;Sin Asignar;Sin Asignar;CMON;AMBA;;ISM-10434;OA;1/2/2021 16:18;1/2/2021 16:18;1/2/2021 16:41;1/2/2021 17:44;1/2/2021 18:31;;-346.163;-583.969;CPU;MOP;Huawei;OA;OA Completado;2021-02-01;;2021-01-21;2021-01-21;2021-02-01;2021-02-01;2021-02-01
20025;CPU036;Mop;NB_IOT;JUAN PABLO;PIANELLO;J. PIANELLO;CMOP;AMBA;;ISM-10435;OA;17/11/2020 13:45;17/11/2020 13:45;26/10/2021 17:39;28/10/2021 20:44;29/10/2021 10:30;;-34.612;-583.842;CPU;MOP;Huawei;OA;OA Completado;2021-10-05;;2021-09-29;2021-09-29;2021-09-30;2021-10-05;2021-09-30
20026;CPU265;Mercedes;NB_IOT;MATIAS EZEQUIEL;COSENTINO;M. COSENTINO;CMRC;AMBA;;ISM-10436;OA;18/11/2020 14:28;18/11/2020 14:28;17/2/2021 23:51;4/3/2021 15:45;5/3/2021 18:47;;-346.257;-584.869;CPU;MOP;Huawei;OA;OA Completado;2021-03-08;;2021-02-11;2021-02-11;2021-02-11;2021-03-08;2021-02-11
20027;CPU062;Monroe;NB_IOT;MATIAS EZEQUIEL;COSENTINO;M. COSENTINO;CMRE;AMBA;;ISM-10437;OA;17/11/2020 14:01;17/11/2020 14:01;17/2/2021 23:53;4/3/2021 16:11;5/3/2021 18:42;;-345.677;-584.758;CPU;MOP;Huawei;OA;OA Completado;2021-03-08;;2021-02-11;2021-02-11;2021-02-11;2021-03-08;2021-02-11
20028;CPU084;Marangoni;NB_IOT;JUAN PABLO;PIANELLO;J. PIANELLO;CMRG;AMBA;;ISM-10438;OA;17/11/2020 14:08;17/11/2020 14:08;26/10/2021 17:37;28/10/2021 20:23;29/10/2021 10:32;;-345.831;-584.057;CPU;MOP;Huawei;OA;OA Completado;2021-10-05;;2021-09-29;2021-09-29;2021-10-05;2021-10-05;2021-09-30
20029;CPU262;Mataderos 2;NB_IOT;JUAN PABLO;PIANELLO;J. PIANELLO;CMT2;AMBA;;ISM-10439;OA;18/11/2020 14:28;18/11/2020 14:28;26/10/2021 17:37;28/10/2021 19:43;29/10/2021 10:36;;-346.562;-584.999;CPU;MOP;Huawei;OA;OA Completado;2021-10-05;;2021-09-30;2021-09-30;2021-10-05;2021-10-05;2021-09-30
20030;CPU172;Mataderos;NB_IOT;Sin Asignar;Sin Asignar;Sin Asignar;CMTA;AMBA;;ISM-10440;OA;18/11/2020 10:14;18/11/2020 10:14;21/1/2021 12:40;21/1/2021 13:34;25/1/2021 14:14;;-346.615;-584.895;CPU;MOP;Huawei;OA;OA Completado;2021-01-25;;2021-01-21;2021-01-21;2021-01-21;2021-01-25;2021-01-21
20031;CPU377;Montagne;NB_IOT;JUAN PABLO;PIANELLO;J. PIANELLO;CMTG;AMBA;;ISM-10441;OA;18/11/2020 15:31;18/11/2020 15:31;26/10/2021 17:37;28/10/2021 18:56;29/10/2021 10:39;;-345.891;-584.376;CPU;MOP;Huawei;OA;OA Completado;2021-10-05;;2021-09-30;2021-09-30;2021-10-05;2021-10-05;2021-09-30
20032;CPU029;Montevideo;NB_IOT;Sin Asignar;Sin Asignar;Sin Asignar;CMTVTP;AMBA;;ISM-10442;OA;17/11/2020 13:30;17/11/2020 13:30;10/2/2021 17:03;10/2/2021 23:30;17/2/2021 07:59;;-34.604;-583.895;CPU;MOP;Huawei;OA;OA Completado;2021-02-10;;2021-01-20;2021-02-08;2021-02-10;2021-02-10;2021-02-10
20033;CPU693;Nextel Alsina;NB_IOT;JUAN PABLO;PIANELLO;J. PIANELLO;CNAL;AMBA;;ISM-10443;OA;19/11/2020 12:24;19/11/2020 12:24;26/10/2021 17:37;28/10/2021 19:38;29/10/2021 10:36;;-346.133;-584.085;CPU;MOP;Huawei;OA;OA Completado;2021-10-05;;2021-10-01;2021-10-01;2021-10-05;2021-10-05;2021-09-30
20034;CPU760;Nextel Alvear;NB_IOT;JUAN PABLO;PIANELLO;J. PIANELLO;CNALVR;AMBA;;ISM-10444;OA;19/11/2020 14:21;19/11/2020 14:21;26/10/2021 17:37;28/10/2021 19:54;29/10/2021 10:34;;;;;MOP;Huawei;OA;OA Completado;2021-10-05;;2021-10-01;2021-10-01;2021-10-05;2021-10-05;2021-09-30
20035;CPU258;Naon;NB_IOT;MATIAS EZEQUIEL;COSENTINO;M. COSENTINO;CNAO;AMBA;;ISM-10445;OA;18/11/2020 14:24;18/11/2020 14:24;17/2/2021 23:53;4/3/2021 16:14;5/3/2021 18:42;;-345.723;-584.682;CPU;MOP;Huawei;OA;OA Completado;2021-03-08;;2021-02-17;2021-02-17;2021-02-17;2021-03-08;2021-02-17
20036;CPU641;Nextel ARioz;NB_IOT;JUAN PABLO;PIANELLO;J. PIANELLO;CNAROZ;AMBA;;ISM-10446;OA;19/11/2020 12:09;19/11/2020 12:09;26/10/2021 17:37;28/10/2021 20:37;29/10/2021 10:30;;-345.887;-584.196;CPU;MOP;Huawei;OA;OA Completado;2021-10-05;;2021-10-01;2021-10-01;2021-10-05;2021-10-05;2021-09-30
20037;CPU602;Nextel Arcos;NB_IOT;Sin Asignar;Sin Asignar;Sin Asignar;CNAR;AMBA;;ISM-10447;OA;19/11/2020 12:04;19/11/2020 12:04;27/1/2021 16:54;27/1/2021 17:55;28/1/2021 12:45;;-345.552;-58.459;CPU;MOP;Huawei;OA;OA Completado;2021-01-28;;2021-01-27;2021-01-27;2021-01-28;2021-01-28;2021-01-28
20038;CPU700;Nextel Avenida Saenz;NB_IOT;JUAN PABLO;PIANELLO;J. PIANELLO;CNAS;AMBA;;ISM-10448;OA;19/11/2020 12:27;19/11/2020 12:27;26/10/2021 17:39;28/10/2021 20:44;29/10/2021 10:30;;-346.541;-584.171;CPU;MOP;Huawei;OA;OA Completado;2021-10-05;;2021-10-01;2021-10-01;2021-10-05;2021-10-05;2021-09-30
20039;CPU816;Nextel  Av de Mayo;NB_IOT;JUAN PABLO;PIANELLO;J. PIANELLO;CNAVMY;AMBA;;ISM-10449;OA;19/11/2020 14:59;19/11/2020 14:59;26/10/2021 17:37;28/10/2021 20:05;29/10/2021 10:32;;-346.089;-583.777;;MOP;Huawei;OA;OA Completado;2021-10-05;;2021-10-01;2021-10-01;2021-10-05;2021-10-05;2021-09-30
20040;CPU190;Nazca;NB_IOT;JUAN PABLO;PIANELLO;J. PIANELLO;CNZA;AMBA;;ISM-10450;OA;18/11/2020 12:53;18/11/2020 12:53;26/10/2021 17:37;28/10/2021 20:33;29/10/2021 10:30;;-346.073;-584.846;CPU;MOP;Huawei;OA;OA Completado;2021-10-05;;2021-09-30;2021-09-30;2021-10-05;2021-10-05;2021-09-30
20041;CPU305;Nextel Bartolome Mitre;NB_IOT;MATIAS EZEQUIEL;COSENTINO;M. COSENTINO;CNBM;AMBA;;ISM-10451;OA;18/11/2020 14:57;18/11/2020 14:57;17/2/2021 23:53;3/3/2021 15:06;5/3/2021 18:51;;-346.072;-583.829;CPU;MOP;Huawei;OA;OA Completado;2021-03-08;;2021-02-11;2021-02-11;2021-02-11;2021-03-08;2021-02-11
20042;CPU477;Nextel Boedo;NB_IOT;Sin Asignar;Sin Asignar;Sin Asignar;CNBO;AMBA;;ISM-10452;OA;19/11/2020 10:50;19/11/2020 10:50;5/2/2021 12:36;5/2/2021 15:29;14/2/2021 19:57;;-346.212;-58.417;CPU;MOP;Huawei;OA;OA Completado;2021-02-05;;2021-02-05;2021-02-05;2021-02-05;2021-02-05;2021-02-05
20043;CPU685;Nextel Brasil;NB_IOT;JUAN PABLO;PIANELLO;J. PIANELLO;CNBRAS;AMBA;;ISM-10453;OA;19/11/2020 12:22;19/11/2020 12:22;26/10/2021 17:37;28/10/2021 19:29;29/10/2021 10:36;;-346.288;-583.859;CPU;MOP;Huawei;OA;OA Completado;2021-10-05;;2021-10-01;2021-10-01;2021-10-05;2021-10-05;2021-09-30
20044;CPU762;Nextel Barracas;NB_IOT;JUAN PABLO;PIANELLO;J. PIANELLO;CNBRCS;AMBA;;ISM-10454;OA;19/11/2020 14:21;19/11/2020 14:21;26/10/2021 17:37;28/10/2021 20:32;29/10/2021 10:30;;-346.467;-583.817;CPU;MOP;Huawei;OA;OA Completado;2021-10-05;;2021-10-01;2021-10-01;2021-10-05;2021-10-05;2021-09-30
20045;CPU483;Nextel Cid Campeador;NB_IOT;JUAN PABLO;PIANELLO;J. PIANELLO;CNCC;AMBA;;ISM-10455;OA;19/11/2020 10:54;19/11/2020 10:54;26/10/2021 17:37;28/10/2021 20:08;29/10/2021 10:32;;-346.056;-584.553;CPU;MOP;Huawei;OA;OA Completado;2021-10-05;;2021-10-01;2021-10-01;2021-10-05;2021-10-05;2021-09-30
20046;CPU598;Nextel Club Municipal;NB_IOT;MATIAS EZEQUIEL;COSENTINO;M. COSENTINO;CNCM;AMBA;;ISM-10456;OA;19/11/2020 12:02;19/11/2020 12:02;17/2/2021 23:51;3/3/2021 13:14;5/3/2021 18:51;;-345.476;-584.607;CPU;MOP;Huawei;OA;OA Completado;2021-03-08;;2021-02-11;2021-02-11;2021-02-11;2021-03-08;2021-02-11
20047;CPU689;Nextel Combate de los Pozos;NB_IOT;MATIAS EZEQUIEL;COSENTINO;M. COSENTINO;CNCP;AMBA;;ISM-10457;OA;19/11/2020 12:22;19/11/2020 12:22;17/2/2021 23:53;4/3/2021 16:03;5/3/2021 18:44;;-346.166;-583.943;CPU;MOP;Huawei;OA;OA Completado;2021-03-08;;2021-02-18;2021-02-18;2021-02-18;2021-03-08;2021-02-18
20048;CPU771;Nextel Diagonal Norte;NB_IOT;JUAN PABLO;PIANELLO;J. PIANELLO;CNDIAN;AMBA;;ISM-10458;OA;19/11/2020 14:32;19/11/2020 14:32;26/10/2021 17:37;28/10/2021 20:17;29/10/2021 10:32;;-346.065;-583.767;CPU;MOP;Huawei;OA;OA Completado;2021-10-05;;2021-10-01;2021-10-01;2021-10-05;2021-10-05;2021-09-30
20050;CPU297;Nextel Darsena Sud;NB_IOT;JUAN PABLO;PIANELLO;J. PIANELLO;CNDS;AMBA;;ISM-10460;OA;18/11/2020 14:55;18/11/2020 14:55;26/10/2021 17:37;28/10/2021 19:03;29/10/2021 10:39;;-346.141;-583.697;CPU;MOP;Huawei;OA;OA Completado;2021-10-05;;2021-09-30;2021-09-30;2021-10-05;2021-10-05;2021-10-30
20051;CPU814;Nextel Entre Rios;NB_IOT;JUAN PABLO;PIANELLO;J. PIANELLO;CNERIO_1;AMBA;;ISM-10462;OA;19/11/2020 14:57;19/11/2020 14:57;26/10/2021 17:37;28/10/2021 20:30;29/10/2021 10:30;;;;;MOP;Huawei;OA;OA Completado;2021-10-05;;2021-10-01;2021-10-01;2021-10-05;2021-10-05;2021-09-30
20052;CPU777;Nextel Estado De Israel;NB_IOT;JUAN PABLO;PIANELLO;J. PIANELLO;CNEISR;AMBA;;ISM-10461;OA;19/11/2020 14:37;19/11/2020 14:37;26/10/2021 17:37;28/10/2021 18:56;29/10/2021 10:39;;-346.021;-584.294;CPU;MOP;Huawei;OA;OA Completado;2021-10-05;;2021-10-01;2021-10-01;2021-10-05;2021-10-05;2021-09-30
20053;CPU779;Nextel Gaona Oeste 2;NB_IOT;JUAN PABLO;PIANELLO;J. PIANELLO;CNGAO2;AMBA;;ISM-10463;OA;19/11/2020 14:39;19/11/2020 14:39;26/10/2021 17:37;28/10/2021 20:37;29/10/2021 10:30;;-346.283;-584.798;CPU;MOP;Huawei;OA;OA Completado;2021-10-05;;2021-10-01;2021-10-01;2021-10-05;2021-10-05;2021-09-30
20054;CPU773;Nextel Gaona;NB_IOT;JUAN PABLO;PIANELLO;J. PIANELLO;CNGAON;AMBA;;ISM-10464;OA;19/11/2020 14:33;19/11/2020 14:33;26/10/2021 17:37;28/10/2021 19:09;29/10/2021 10:39;;-346.253;-584.743;CPU;MOP;Huawei;OA;OA Completado;2021-10-05;;2021-10-01;2021-10-01;2021-10-05;2021-10-05;2021-09-30
20055;CPU695;Nextel Coghlan;NB_IOT;JUAN PABLO;PIANELLO;J. PIANELLO;CNGH;AMBA;;ISM-10465;OA;19/11/2020 12:26;19/11/2020 12:26;26/10/2021 17:37;28/10/2021 19:34;29/10/2021 10:36;;-345.656;-584.711;CPU;MOP;Huawei;OA;OA Completado;2021-10-05;;2021-10-01;2021-10-01;2021-10-05;2021-10-05;2021-09-30
20056;CPU699;Nextel Giol;NB_IOT;JUAN PABLO;PIANELLO;J. PIANELLO;CNGI;AMBA;;ISM-10466;OA;19/11/2020 12:27;19/11/2020 12:27;26/10/2021 17:37;28/10/2021 19:09;29/10/2021 10:39;;-345.887;-584.327;CPU;MOP;Huawei;OA;OA Completado;2021-10-05;;2021-10-01;2021-10-01;2021-10-05;2021-10-05;2021-09-30
20057;CPU207;Nextel GURRUCHAGA;NB_IOT;MATIAS EZEQUIEL;COSENTINO;M. COSENTINO;CNGURR;AMBA;;ISM-10467;OA;18/11/2020 15:02;18/11/2020 15:02;17/2/2021 23:51;4/3/2021 15:45;5/3/2021 18:47;;-345.924;-584.308;;MOP;Huawei;OA;OA Completado;2021-03-08;;2021-02-17;2021-02-17;2021-02-17;2021-03-08;2021-02-17
20058;CPU563;Nogoya;NB_IOT;SEBASTIAN;ANGELERI;S. ANGELERI;CNGY;AMBA;;ISM-10468;OA;19/11/2020 11:10;19/11/2020 11:10;26/10/2021 17:37;28/10/2021 18:58;29/10/2021 10:39;;-346.062;-584.978;CPU;MOP;Huawei;OA;OA Completado;2021-10-06;;2021-10-01;2021-10-01;2021-10-05;2021-10-06;2021-09-30
20059;CPU345;Nextel Hospital Alvarez;NB_IOT;JUAN PABLO;PIANELLO;J. PIANELLO;CNHALV;AMBA;;ISM-10469;OA;18/11/2020 15:24;18/11/2020 15:24;26/10/2021 17:37;28/10/2021 19:12;29/10/2021 10:38;;-346.242;-584.641;CPU;MOP;Huawei;OA;OA Completado;2021-10-05;;2021-09-30;2021-09-30;2021-10-05;2021-10-05;2021-09-30
20060;CPU763;Nextel Hospital Francos;NB_IOT;JUAN PABLO;PIANELLO;J. PIANELLO;CNHFRA;AMBA;;ISM-10470;OA;19/11/2020 14:28;19/11/2020 14:28;26/10/2021 17:37;28/10/2021 19:48;29/10/2021 10:36;;;;;MOP;Huawei;OA;OA Completado;2021-10-05;;2021-10-01;2021-10-01;2021-10-05;2021-10-05;2021-09-30
20061;CPU792;Nextel Independencia;NB_IOT;JUAN PABLO;PIANELLO;J. PIANELLO;CNINDP;AMBA;;ISM-10471;OA;19/11/2020 14:53;19/11/2020 14:53;26/10/2021 17:37;28/10/2021 19:54;29/10/2021 10:34;;-346.159;-583.726;CPU;MOP;Huawei;OA;OA Completado;2021-10-05;;2021-10-01;2021-10-01;2021-10-05;2021-10-05;2021-09-30
20062;CPU799;Nextel Jumbo;NB_IOT;MATIAS EZEQUIEL;COSENTINO;M. COSENTINO;CNJU;AMBA;;ISM-10472;OA;19/11/2020 14:55;19/11/2020 14:55;17/2/2021 23:51;3/3/2021 12:56;5/3/2021 18:51;;-345.752;-584.274;CPU;MOP;Huawei;OA;OA Completado;2021-03-08;;2021-02-18;2021-02-18;2021-02-18;2021-03-08;2021-02-18
20063;CPU686;La Boca Almirante Brown;NB_IOT;Sin Asignar;Sin Asignar;Sin Asignar;CNLBOC_1;AMBA;;ISM-10473;OA;19/11/2020 12:22;19/11/2020 12:22;27/1/2021 16:45;27/1/2021 17:51;28/1/2021 12:11;;-346.361;-583.584;;MOP;Huawei;OA;OA Completado;2021-01-27;;2021-01-27;2021-01-27;2021-01-27;2021-01-27;2021-01-27
20064;CPU798;Nextel Virrey Loreto;NB_IOT;JUAN PABLO;PIANELLO;J. PIANELLO;CNLO;AMBA;;ISM-10474;OA;19/11/2020 14:55;19/11/2020 14:55;26/10/2021 17:37;28/10/2021 19:30;29/10/2021 10:36;;-345.652;-584.467;CPU;MOP;Huawei;OA;OA Completado;2021-10-05;;2021-10-01;2021-10-01;2021-10-05;2021-10-05;2021-09-30
20065;CPU789;Nextel Av La Plata;NB_IOT;JUAN PABLO;PIANELLO;J. PIANELLO;CNLPLT;AMBA;;ISM-10475;OA;19/11/2020 14:46;19/11/2020 14:46;26/10/2021 17:39;28/10/2021 20:55;29/10/2021 10:29;;-346.179;-584.284;CPU;MOP;Huawei;OA;OA Completado;2021-10-05;;2021-10-01;2021-10-01;2021-10-05;2021-10-05;2021-09-30
20066;CPU502;Nextel Villa Lugano;NB_IOT;MATIAS EZEQUIEL;COSENTINO;M. COSENTINO;CNLUTP;AMBA;;ISM-10476;OA;19/11/2020 10:57;19/11/2020 10:57;17/2/2021 23:51;3/3/2021 12:04;5/3/2021 18:53;;-346.696;-584.814;CPU;MOP;Huawei;OA;OA Completado;2021-03-08;;2021-02-18;2021-02-18;2021-02-18;2021-03-08;2021-02-18
20067;CPU796;Nextel Lope de Vega;NB_IOT;MATIAS EZEQUIEL;COSENTINO;M. COSENTINO;CNLV;AMBA;;ISM-10477;OA;19/11/2020 14:55;19/11/2020 14:55;17/2/2021 23:53;4/3/2021 15:56;5/3/2021 18:45;;-346.037;-585.241;CPU;MOP;Huawei;OA;OA Completado;2021-03-08;;2021-02-18;2021-02-18;2021-02-18;2021-03-08;2021-02-18
20068;CPU551;Nextel Villa Lynch;NB_IOT;JUAN PABLO;PIANELLO;J. PIANELLO;CNLY;AMBA;;ISM-10478;OA;19/11/2020 11:08;19/11/2020 11:08;26/10/2021 17:37;28/10/2021 19:11;29/10/2021 10:39;;-345.929;-585.143;CPU;MOP;Huawei;OA;OA Completado;2021-10-05;;2021-10-01;2021-10-01;2021-10-05;2021-10-05;2021-09-30
20069;CPU396;Nextel Montevideo;NB_IOT;JUAN PABLO;PIANELLO;J. PIANELLO;CNMVDO;AMBA;;ISM-10479;OA;18/11/2020 15:49;18/11/2020 15:49;26/10/2021 17:39;28/10/2021 20:51;29/10/2021 10:29;;-346.011;-583.897;CPU;MOP;Huawei;OA;OA Completado;2021-10-05;;2021-09-30;2021-09-30;2021-10-05;2021-10-05;2021-09-30
20070;CPU702;Nextel Niceto Vega;NB_IOT;JUAN PABLO;PIANELLO;J. PIANELLO;CNNV;AMBA;;ISM-10480;OA;19/11/2020 12:29;19/11/2020 12:29;26/10/2021 17:37;28/10/2021 20:37;29/10/2021 10:30;;-34.584;-584.464;CPU;MOP;Huawei;OA;OA Completado;2021-10-05;;2021-10-01;2021-10-01;2021-10-05;2021-10-05;2021-09-30
20072;CPU794;Nextel Pasco;NB_IOT;JUAN PABLO;PIANELLO;J. PIANELLO;CNPA;AMBA;;ISM-10482;OA;19/11/2020 14:53;19/11/2020 14:53;26/10/2021 17:39;28/10/2021 20:51;29/10/2021 10:29;;-346.092;-583.993;CPU;MOP;Huawei;OA;OA Completado;2021-10-05;;2021-10-01;2021-10-01;2021-10-05;2021-10-05;2021-09-30
20073;CPU778;Nextel Parque Chacabuco Este;NB_IOT;JUAN PABLO;PIANELLO;J. PIANELLO;CNPCHE;AMBA;;ISM-10483;OA;19/11/2020 14:37;19/11/2020 14:37;26/10/2021 17:37;28/10/2021 19:23;29/10/2021 10:38;;-346.297;-584.387;CPU;MOP;Huawei;OA;OA Completado;2021-10-05;;2021-10-01;2021-10-01;2021-10-05;2021-10-05;2021-09-30
20074;CPU788;Nextel Parque Nagera;NB_IOT;Sin Asignar;Sin Asignar;Sin Asignar;CNPNAG;AMBA;;ISM-10484;OA;19/11/2020 14:44;19/11/2020 14:44;27/1/2021 16:21;27/1/2021 17:03;28/1/2021 11:48;;-346.642;-584.743;CPU;MOP;Huawei;OA;OA Completado;2021-01-27;;2021-01-27;2021-01-27;2021-01-27;2021-01-27;2021-01-27
20075;CPU217;Nueva Pompeya Oeste;NB_IOT;MATIAS EZEQUIEL;COSENTINO;M. COSENTINO;CNPOMO;AMBA;;ISM-10485;OA;18/11/2020 13:43;18/11/2020 13:43;17/2/2021 23:51;4/3/2021 15:45;5/3/2021 18:47;;;;;MOP;Huawei;OA;OA Completado;2021-03-08;;2021-02-10;2021-02-10;2021-02-12;2021-03-08;2021-02-12
20076;CPU694;Nextel Pasteur;NB_IOT;JUAN PABLO;PIANELLO;J. PIANELLO;CNPS;AMBA;;ISM-10486;OA;19/11/2020 12:24;19/11/2020 12:24;26/10/2021 17:37;28/10/2021 19:34;29/10/2021 10:36;;-346.026;-58.4;CPU;MOP;Huawei;OA;OA Completado;2021-10-05;;2021-10-01;2021-10-01;2021-10-05;2021-10-05;2021-09-30
20077;CPU782;Nextel Paternal;NB_IOT;JUAN PABLO;PIANELLO;J. PIANELLO;CNPTRN;AMBA;;ISM-10487;OA;19/11/2020 14:41;19/11/2020 14:41;26/10/2021 17:39;28/10/2021 21:13;29/10/2021 10:25;;-345.981;-584.561;CPU;MOP;Huawei;OA;OA Completado;2021-10-05;;2021-10-01;2021-10-01;2021-10-05;2021-10-05;2021-09-30
20078;CPU772;Nextel Salguero;NB_IOT;MATIAS EZEQUIEL;COSENTINO;M. COSENTINO;CNSALG;AMBA;;ISM-10488;OA;19/11/2020 14:33;19/11/2020 14:33;17/2/2021 23:53;4/3/2021 16:02;5/3/2021 18:45;;-345.744;-584.035;CPU;MOP;Huawei;OA;OA Completado;2021-03-08;;2021-02-12;2021-02-12;2021-02-12;2021-03-08;2021-02-12
20079;CPU696;Nextel Saavedra;NB_IOT;Sin Asignar;Sin Asignar;Sin Asignar;CNSATP;AMBA;;ISM-10489;OA;19/11/2020 12:26;19/11/2020 12:26;27/1/2021 13:03;27/1/2021 15:35;28/1/2021 11:53;;-345.504;-584.762;CPU;MOP;Huawei;OA;OA Completado;2021-01-27;;2021-01-26;2021-01-27;2021-01-27;2021-01-27;2021-01-27
20080;CPU670;SCALABRINI ORTIZ;NB_IOT;JUAN PABLO;PIANELLO;J. PIANELLO;CNSCAO;AMBA;;ISM-10490;OA;19/11/2020 12:15;19/11/2020 12:15;26/10/2021 17:37;28/10/2021 19:07;29/10/2021 10:39;;;;;MOP;Huawei;OA;OA Completado;2021-10-05;;2021-10-01;2021-10-01;2021-10-05;2021-10-05;2021-09-30
20081;CPU539;Nextel Segurola;NB_IOT;JUAN PABLO;PIANELLO;J. PIANELLO;CNSEGU;AMBA;;ISM-10491;OA;19/11/2020 11:06;19/11/2020 11:06;26/10/2021 17:37;28/10/2021 19:09;29/10/2021 10:39;;-346.119;-585.067;CPU;MOP;Huawei;OA;OA Completado;2021-10-05;;2021-10-01;2021-10-01;2021-10-05;2021-10-05;2021-09-30
20082;CPU690;Nextel Santa Fe;NB_IOT;JUAN PABLO;PIANELLO;J. PIANELLO;CNSF;AMBA;;ISM-10492;OA;19/11/2020 12:24;19/11/2020 12:24;26/10/2021 17:37;28/10/2021 20:08;29/10/2021 10:32;;-345.901;-584.081;CPU;MOP;Huawei;OA;OA Completado;2021-10-05;;2021-10-01;2021-10-01;2021-10-05;2021-10-05;2021-09-30
20083;CPU339;Nextel San Jose;NB_IOT;JUAN PABLO;PIANELLO;J. PIANELLO;CNSJ;AMBA;;ISM-10493;OA;18/11/2020 15:24;18/11/2020 15:24;26/10/2021 17:39;28/10/2021 21:20;29/10/2021 10:25;;-346.211;-583.869;CPU;MOP;Huawei;OA;OA Completado;2021-10-05;;2021-09-30;2021-09-30;2021-10-05;2021-10-05;2021-09-30
20084;CPU697;Nextel Soldati;NB_IOT;JUAN PABLO;PIANELLO;J. PIANELLO;CNSL;AMBA;;ISM-10494;OA;19/11/2020 12:27;19/11/2020 12:27;26/10/2021 17:37;28/10/2021 19:34;29/10/2021 10:36;;-346.635;-584.417;CPU;MOP;Huawei;OA;OA Completado;2021-10-05;;2021-10-01;2021-10-01;2021-10-05;2021-10-05;2021-09-30
20085;CPU534;Nextel Saenz Peña;NB_IOT;JUAN PABLO;PIANELLO;J. PIANELLO;CNSP;AMBA;;ISM-10495;OA;19/11/2020 11:06;19/11/2020 11:06;26/10/2021 17:37;28/10/2021 20:32;29/10/2021 10:30;;-346.164;-58.527;CPU;MOP;Huawei;OA;OA Completado;2021-10-05;;2021-10-01;2021-10-01;2021-10-05;2021-10-05;2021-09-30
20086;CPU530;Nextel Timoteo Gordillo;NB_IOT;JUAN PABLO;PIANELLO;J. PIANELLO;CNTIGO;AMBA;;ISM-10496;OA;19/11/2020 11:03;19/11/2020 11:03;26/10/2021 17:37;28/10/2021 19:11;29/10/2021 10:39;;-346.594;-585.047;CPU;MOP;Huawei;OA;OA Completado;2021-10-05;;2021-10-01;2021-10-01;2021-10-05;2021-10-05;2021-09-30
20087;CPU482;Nextel Trole;NB_IOT;JUAN PABLO;PIANELLO;J. PIANELLO;CNTL;AMBA;;ISM-10497;OA;19/11/2020 10:52;19/11/2020 10:52;26/10/2021 17:37;28/10/2021 19:54;29/10/2021 10:34;;-346.382;-584.162;CPU;MOP;Huawei;OA;OA Completado;2021-10-05;;2021-10-01;2021-10-01;2021-10-05;2021-10-05;2021-09-30
20088;CPU698;Nextel Centenario;NB_IOT;JUAN PABLO;PIANELLO;J. PIANELLO;CNTN;AMBA;;ISM-10498;OA;19/11/2020 12:27;19/11/2020 12:27;26/10/2021 17:37;28/10/2021 20:21;29/10/2021 10:32;;-346.056;-584.308;CPU;MOP;Huawei;OA;OA Completado;2021-10-05;;2021-10-01;2021-10-01;2021-10-05;2021-10-05;2021-09-30
20089;CPU259;Nextel Triunvirato;NB_IOT;JUAN PABLO;PIANELLO;J. PIANELLO;CNTRNV;AMBA;;ISM-10499;OA;18/11/2020 14:26;18/11/2020 14:26;26/10/2021 17:39;28/10/2021 20:55;29/10/2021 10:29;;-345.785;-584.792;CPU;MOP;Huawei;OA;OA Completado;2021-10-05;;2021-09-30;2021-09-30;2021-10-05;2021-10-05;2021-09-30
20090;CPU234;Nextel Terrero;NB_IOT;Sin Asignar;Sin Asignar;Sin Asignar;CNTR;AMBA;;ISM-10500;OA;18/11/2020 13:54;18/11/2020 13:54;21/1/2021 12:47;21/1/2021 13:39;22/1/2021 12:22;;-346.261;-584.577;CPU;MOP;Huawei;OA;OA Completado;2021-01-22;;2021-01-21;2021-01-21;2021-01-22;2021-01-22;2021-01-22
20091;CPU666;Nuñez Oeste;NB_IOT;JUAN PABLO;PIANELLO;J. PIANELLO;CNUNZO;AMBA;;ISM-10501;OA;19/11/2020 12:13;19/11/2020 12:13;26/10/2021 17:37;28/10/2021 20:41;29/10/2021 10:30;;-345.512;-584.668;CPU;MOP;Huawei;OA;OA Completado;2021-10-05;;2021-10-01;2021-10-01;2021-10-05;2021-10-05;2021-09-30
20092;CPU398;Nuñez 3 de Febrero;NB_IOT;MATIAS EZEQUIEL;COSENTINO;M. COSENTINO;CNUZ3F;AMBA;;ISM-10502;OA;18/11/2020 15:49;18/11/2020 15:49;17/2/2021 23:53;4/3/2021 15:58;5/3/2021 18:45;;;;;MOP;Huawei;OA;OA Completado;2021-03-08;;2021-02-10;2021-02-10;2021-02-12;2021-03-08;2021-02-12
20093;CPU784;Nextel Villa Catalina;NB_IOT;Sin Asignar;Sin Asignar;Sin Asignar;CNVCAT;AMBA;;ISM-10503;OA;19/11/2020 14:42;19/11/2020 14:42;27/1/2021 16:20;27/1/2021 17:01;28/1/2021 11:46;;-345.677;-584.938;CPU;MOP;Huawei;OA;OA Completado;2021-01-27;;2021-01-27;2021-01-27;2021-01-27;2021-01-27;2021-01-27
20094;CPU783;Nextel Villa Crespo;NB_IOT;MATIAS EZEQUIEL;COSENTINO;M. COSENTINO;CNVCRE;AMBA;;ISM-10504;OA;19/11/2020 14:41;19/11/2020 14:41;17/2/2021 23:51;4/3/2021 15:45;5/3/2021 18:47;;-345.996;-584.484;CPU;MOP;Huawei;OA;OA Completado;2021-03-08;;2021-02-12;2021-02-12;2021-02-12;2021-03-08;2021-02-12
20095;CPU766;Nextel Versailles;NB_IOT;Sin Asignar;Sin Asignar;Sin Asignar;CNVERS;AMBA;;ISM-10505;OA;18/11/2020 11:28;18/11/2020 11:28;27/1/2021 16:23;27/1/2021 17:30;28/1/2021 16:32;;-346.296;-585.271;CPU;MOP;Huawei;OA;OA Completado;2021-01-27;;2021-01-27;2021-01-27;2021-01-27;2021-01-27;2021-01-27
20096;CPU529;Nextel Villa Luro;NB_IOT;JUAN PABLO;PIANELLO;J. PIANELLO;CNVL;AMBA;;ISM-10506;OA;19/11/2020 11:03;19/11/2020 11:03;26/10/2021 17:39;28/10/2021 20:51;29/10/2021 10:29;;-346.539;-584.878;CPU;MOP;Huawei;OA;OA Completado;2021-10-05;;2021-10-01;2021-10-01;2021-10-05;2021-10-05;2021-09-30
20097;CPU589;Nextel Villa Pueyrredon;NB_IOT;JUAN PABLO;PIANELLO;J. PIANELLO;CNVPUY;AMBA;;ISM-10507;OA;19/11/2020 12:02;19/11/2020 12:02;26/10/2021 17:39;28/10/2021 21:18;29/10/2021 10:25;;-345.847;-585.122;CPU;MOP;Huawei;OA;OA Completado;2021-10-05;;2021-10-01;2021-10-01;2021-10-05;2021-10-05;2021-09-30
20098;CPU584;Nextel Villa Urquiza;NB_IOT;JUAN PABLO;PIANELLO;J. PIANELLO;CNVU;AMBA;;ISM-10508;OA;19/11/2020 12:00;19/11/2020 12:00;26/10/2021 17:39;28/10/2021 21:17;29/10/2021 10:25;;-345.748;-584.903;CPU;MOP;Huawei;OA;OA Completado;2021-10-05;;2021-10-01;2021-10-01;2021-10-05;2021-10-05;2021-09-30
20099;CPU756;Nextel Ayacucho;NB_IOT;JUAN PABLO;PIANELLO;J. PIANELLO;CNXAYA;AMBA;;ISM-10509;OA;19/11/2020 14:19;19/11/2020 14:19;26/10/2021 17:39;28/10/2021 20:50;29/10/2021 10:30;;-346.062;-583.946;CPU;MOP;Huawei;OA;OA Completado;2021-10-05;;2021-10-01;2021-10-01;2021-10-05;2021-10-05;2021-09-30
20101;CPU769;Nextel Cabildo;NB_IOT;JUAN PABLO;PIANELLO;J. PIANELLO;CNXCAB;AMBA;;ISM-10511;OA;19/11/2020 14:30;19/11/2020 14:30;26/10/2021 17:37;28/10/2021 19:52;29/10/2021 10:34;;-345.727;-584.402;CPU;MOP;Huawei;OA;OA Completado;2021-10-05;;2021-10-01;2021-10-01;2021-10-05;2021-10-05;2021-09-30
20102;CPU761;Nextel Chiclana;NB_IOT;MATIAS EZEQUIEL;COSENTINO;M. COSENTINO;CNXCHI;AMBA;;ISM-10512;OA;19/11/2020 14:21;19/11/2020 14:21;17/2/2021 23:53;3/3/2021 16:27;5/3/2021 18:51;;-346.326;-584.176;CPU;MOP;Huawei;OA;OA Completado;2021-03-08;;2021-02-10;2021-02-10;2021-02-12;2021-03-08;2021-02-12
20103;CPU775;Nextel Diagonal Sur;NB_IOT;JUAN PABLO;PIANELLO;J. PIANELLO;CNXDGS;AMBA;;ISM-10513;OA;19/11/2020 14:35;19/11/2020 14:35;26/10/2021 17:39;28/10/2021 21:13;29/10/2021 10:27;;-346.108;-58.379;CPU;MOP;Huawei;OA;OA Completado;2021-10-05;;2021-10-01;2021-10-01;2021-10-05;2021-10-05;2021-09-30
20104;CPU764;Nextel Floresta;NB_IOT;JUAN PABLO;PIANELLO;J. PIANELLO;CNXFLT;AMBA;;ISM-10514;OA;19/11/2020 14:28;19/11/2020 14:28;26/10/2021 17:37;28/10/2021 19:09;29/10/2021 10:39;;-34.642;-584.682;CPU;MOP;Huawei;OA;OA Completado;2021-10-05;;2021-10-01;2021-10-01;2021-10-05;2021-10-05;2021-09-30
20105;CPU770;Nextel Forest;NB_IOT;JUAN PABLO;PIANELLO;J. PIANELLO;CNXFOR;AMBA;;ISM-10515;OA;19/11/2020 14:32;19/11/2020 14:32;26/10/2021 17:39;28/10/2021 21:13;29/10/2021 10:25;;-34.576;-584.644;CPU;MOP;Huawei;OA;OA Completado;2021-10-05;;2021-10-01;2021-10-01;2021-10-05;2021-10-05;2021-09-30
20106;CPU790;Nextel Humberto I;NB_IOT;JUAN PABLO;PIANELLO;J. PIANELLO;CNXHUI;AMBA;;ISM-10517;OA;19/11/2020 14:50;19/11/2020 14:50;26/10/2021 17:39;28/10/2021 20:59;29/10/2021 10:27;;;;;MOP;Huawei;OA;OA Completado;2021-10-05;;2021-10-01;2021-10-01;2021-10-05;2021-10-05;2021-09-30
20107;CPU776;Nextel Larrea;NB_IOT;JUAN PABLO;PIANELLO;J. PIANELLO;CNXLAR;AMBA;;ISM-10518;RFI;19/11/2020 14:37;19/11/2020 14:37;;;;;-346.064;-584.014;CPU;MOP;Huawei;OA;OA Completado;2021-10-05;;2021-10-01;2021-10-01;2021-10-05;2021-10-05;2021-09-30
20108;CPU755;Nextel Loria;NB_IOT;JUAN PABLO;PIANELLO;J. PIANELLO;CNXLOR;AMBA;;ISM-10519;OA;19/11/2020 13:32;19/11/2020 13:32;26/10/2021 17:37;28/10/2021 20:01;29/10/2021 10:34;;-346.064;-584.115;CPU;MOP;Huawei;OA;OA Completado;2021-10-05;;2021-10-01;2021-10-01;2021-10-05;2021-10-05;2021-09-30
